,artist_song,song_x,artist_x,genre,lyric,like,year_x,artist_y,song_y,key,camelot,bpm,duration,popularity,energy,danceability,happiness,acousticness,instrumentalness,liveness,speechiness,loudness,year_y
70,여행스케치 향수 (그때가 그리워),내겐 가장 소중한 너,여행스케치,댄스,널 처음 본 그 순간 마치 마법에 걸린 것처럼 움직일 수가 없어서 또 숨쉴 수도 없었지 지금 널 만날땐 그때 그 느낌은 아니지만 조금씩 닮아가는 모습속에 난 행복해 오랜 시간의 흐름속에 우리도 변해가겠지만 이대로 첫 만남의 느낌을 영원히 간직하고 싶어 내 마음 가득 너의 향길 담아 바람에 날리면 잿빛 하늘 조차 파랗게 물들어 너의 맑은 눈빛처럼 오늘보다 난 내일을 꿈꾸는 나의 바램들을 이룰 수 있는 건 너 때문인거야 내겐 가장 소중한 너  예전에 우리는 서로의 장점만 보여주려 맘에도 없는 말들과 행동을 하기도 했고 지금의 우리는 습관처럼 자주 만나지만 서로의 모난 모습까지도 사랑할 준비가 됐어 오랜 시간의 흐름속에 우리도 변해가겠지만 이대로 첫 만남의 느낌을 영원히 간직하고 싶어 내 마음 가득 너의 향길 담아 바람에 날리면 잿빛 하늘 조차 파랗게 물들어 너의 맑은 눈빛처럼 오늘보다 난 내일을 꿈꾸는 나의 바램들을 이룰 수 있는 건 너 때문인거야 내겐 가장 소중한 너 내 마음 가득 너의 향길 담아 바람에 날리면 잿빛 하늘 조차 파랗게 물들어 너의 맑은 눈빛처럼 오늘 보다 난 내일을 꿈꾸는 나의 바램들을 이룰 수 있는 건 너 때문인거야 내겐 가장 소중한 너 내 마음 가득 너의 향길 담아,"2,505",1998,KNK,I Remember,C Major,8B,95.0,3:28,11.0,80.0,67.0,58.0,38.0,0.0,24.0,4.0,-5 dB,1998
71,정태춘 정동진1,정동진1,정태춘,포크/블루스,텅 빈 대합실 유리창 너머 무지개를 봤지 끝도 없이 밀려오는 파도 그 바다 위 소나기 지나간 정동진 철로 위로 화물 열차도 지나가고 파란 하늘에 일곱 빛깔로 워 아련한 얼굴 가슴 저미는 손짓으로 물보라 너머 꿈결처럼 무지개를 봤지 조각배 하나 넘실대는 먼 바다 위 소나기 지나간 오후 중앙로 철교 아래 그 비를 피하던 내가 파란 하늘에 일곱 빛깔로 워 그리운 것이 저리 멀리 아니 가까이 차마 다시 뒤돌아서 그 쌍무지개를 봤지 텅 빈 객차 달려가는 그 하늘 위,"1,254",1998,"정태춘,박은옥",사랑하는 이에게,G Major,9B,71.0,4:16,19.0,25.0,42.0,11.0,94.0,73.0,28.0,3.0,-13 dB,1998
72,옐로우 하나,하나,옐로우,발라드,우리 헤어져 살아간다면 내가 이 세상에 없기 때문이야 그댄 나 없이 살 수 있지만 그대 없는 나의 삶은 없기에 이 세상 누구도 나의 사랑을 갈라놓을 수가 없는 이유로 또 다시 혼자서 사랑한다면 다시 그대를 만날거야 그대 잊는 날부터 영원히 눈 감아 깨어나지 않는 꿈을 꾸게 해 그대가 있어 시작된 내 삶이 그대 떠나서 끝이 됐으니 잊을 수 있다면 사랑이 아냐 마지막까지 상처가 되어 또 다른 사랑을 만난다 해도 잊을 수 없는 꿈인거야 그대 잊는 날부터 영원히 눈 감아 깨어나지 않는 꿈을 꾸게 해 그대가 있어 시작된 내 삶이 그대 떠나서 끝이 됐으니,28,1998,Key,Camelot,BPM,,,Popularity,,,,,,,,,,1998
73,젝스키스 Road Fighter,Road Fighter,젝스키스,댄스,어떻게 널 두고 나 가나 이 길 끝에 내 몸을 싣고 달려 어떻게 널 두고 나 가나 이 빗속에 내 사랑 싣고 달려 긴긴 내 설득에 돌아보지 않던 너 차가운 이 빗속에서 넌 날 끝내 버렸어 아름답던 입술은 날 더 비웃어 찢긴 나의 가슴 밟고 bye bye 넌 떠났어 널 사랑했던 맘도 날 지탱해준 꿈도 이 빗소리에 씻겨 다 사라지고 있어 나의 몸을 싣고 내 사랑 싣고 달려 이 길이 끝나는 곳에 내 모든걸 완전히 묻어두겠어 차갑던 너의 말에 조금도 늦지 않게 이제는 너에게서 나를 비워줄게 흐르는 나의 눈물을 빗속에 감추려해도 바람을 가른 추억들이 울고있어 달아오른 거리를 밟어 더 빨리 달려 붕 난 더 난 바람속에 내 몸이 날려 달아오른 거리를 밟어 더 빨리 달려 붕 난 더 난 우아 우아 내 몸이 날려 내 몸이 날려 내 몸이 날려 우아 내 몸이 날려 내 몸이 날려 어떻게 널 두고 나 가나 이 길 끝에 내 몸을 싣고 달려 어떻게 널 두고 나 가나 이 빗속에 내 사랑 싣고 달려 뜨거워진 거리 다 태워버릴 거리 이 아픈 거릴 밟아봐 바람을 더 불러봐 하하하 이제 날아가 이길의 끝에 쳐박혀 버려 더 이상 나는 없어 신음속에 (이 빗속에) 벌써 타 버리고 없어 하얗게 떠오르는 내가 널 보고있어 이제야 내 사랑도 편히 잠들겠지 마지막 나의 눈속에 영원히 볼 수 있도록 행복한 너의 그 미소만 가져갈게 달아오른 거리를 밟어 더 빨리 달려 붕 난 더 난 바람속에 내 몸이 날려 달아오른 거리를 밟어 더 빨리 달려 붕 난 더 난 우아 우아 내 몸이 날려,"29,243",1998,Yellowe Jam,하나 둘 셋,G Major,9B,119.0,3:43,0.0,40.0,69.0,28.0,76.0,0.0,10.0,5.0,-9 dB,1998
74,엔알지 (NRG) 사랑만들기,사랑만들기,엔알지 (NRG),댄스,지금 니 앞에 나를 느껴 봐 니 사랑을 기다렸던 내가 있잖아 참아 왔었던 나의 바램모두 너 하나만 바라보던 시간이었어 오직 너만을 너를 사랑해 이젠 내가 니 모든걸 지켜줄거야 남은 날들의 모든 행복은 나의 사랑 너를 위해서 언제나 니 안엔 내가 없다고 혼자서 나를 달래며 많은 사람들 속에 말없이 니 주윌 맴돌곤 했었지 예 여러번 바뀌는 너의 남자를 힘없이 지켜보던 난 다른 사랑 만나도 너만의 행복을 빌어 왔어 하지만 그 때마다 쉽게 끝이 났던 힘에 겨운 널 보면서 니안에 채우려 했던 진짜 사랑은 나란걸 깨달았어 이젠 말할게 너를 사랑해 비워뒀던 내맘 모두 니꺼라는 걸 지난 시간의 못한 바램더해 영원토록 내가 너를 지켜줄거야 지금 이대로 내게 오면 돼 너 아니면 줄 수 없는 나의 품으로 언제까지나 너의 가슴에 큰 사랑을 채워줄거야 왔어 나의 사랑이 왔어 모두 지나갔던 날들 이제 모두 잊어 봐봐 날 지켜봐 영원히 행복해질 널 지켜봐 붐붐 오직 나만이 널 지켜 줄 수가 있어 허어 팡팡 채워줄거야 나의 사랑 너를 위해서 허 지나간 슬픔은 모두 지워 줘 또 새롭게 만든 추억은 너 하나만 지켜 줄 마지막 내 모습이었잖아 지금껏 망설였던 나의 시간만큼 내가 못한걸 줄거야 넌 그저 그 누구보다 행복에 겨운 미소만 보이면 돼 이젠 말할게 너를 사랑해 비워뒀던 내맘 모두 니꺼라는 걸 지난 시간의 못한 바램더해 영원토록 내가 너를 지켜줄거야 지금 이대로 내게 오면 돼 너 아니면 줄 수 없는 나의 품으로 언제 까지나 너의 가슴에 큰 사랑을 채워줄거야 이 세상에 많은 사람들 그 중에서 가장 소중한 그 사랑하나 너의 품안에 채워줄거야 오직 너만을 너를 사랑해 이젠 내가 니모든걸 지켜줄거야 남은 날들의 모든 행복은 나의 사랑 너를 위해서,"1,290",1998,NRG,사랑만들기,E♭ Minor,2A,147.0,4:17,23.0,100.0,70.0,88.0,2.0,0.0,9.0,6.0,-6 dB,1998
75,베이시스(Basis) 세상의 모든 이별,세상의 모든 이별,베이시스(Basis),발라드,끝인가봐 이제 끝난 일인가봐 날카로운 입맞춤의 기억도 이별을 되돌릴 순 없나봐 마지못해 함께 있는 동안에도 자꾸 시계만 들여다보는 너 이별은 늘 이런 식인가봐 참 많이 울었어 남자답지 못하게 이별이란 늘 이렇게 갑자기 오나봐 아냐 이건 너마저 이럴 순 없어 그토록 간절했는데 이별이란 말로 그 모든 게 없었던 일이라니 살아볼께 다시 돌릴 수 없다면 하지만 이건 기억해줘 언젠가는 너도 누군가의 과거일 수 있다는 걸 참 많이 울었어 남자답지 못하게 이별이란 늘 이렇게 갑자기 오나봐 아냐 이건 너마저 이럴 순 없어 그토록 간절했는데 이별이란 말로 그 모든 게 없었던 일이라니 살아볼께 다시 돌릴 수 없다면 하지만 이건 기억해줘 언젠가는 너도 누군가의 과거일 수 있다는 걸,496,1998,Epik High,Love Love Love,C# Minor,12A,128.0,3:51,50.0,88.0,79.0,79.0,6.0,0.0,17.0,6.0,-4 dB,1998
76,R.ef 귀머거리 하늘,귀머거리 하늘,R.ef,댄스,그토록 사랑한 그녀가 떠난 후 하늘은 그녈 내게 보여주곤 해 너무나 예쁜 그 모습 예전의 목소리까지 항상 원할때면 만날 수 있어 너무나 멀어서 만질 수 없으니 안개와 함께라도 내려오라고 햇살에 사라질 안개 너무나 짧은 것 같아 저기 산에 닿은 구름이라도 하늘아 들리지 않니 간절한 내 기도소리 모습만 보이지 말고 한 번만 안을순 없는지 하늘아 제발 도와줘 그녀가 올 수 없다면 나라도 그녀에게 갈 수 있도록 먼하늘 네 모습 바라만 보다가 가슴이 메어와서 눈을 감았어 여전한 너의 목소리 더이상 들을수 없게 나의 눈물들이 내 귀를 채워 들리지 않는가봐 그토록 너의 모습 보여주던 하늘이 내얘긴 들리지 않는가봐 널 보내달라 그렇게 소리 쳤지만 발 밑에 떠있는 안개는 너에게 못 가게 길마저 가려 버렸어 니 목소리 들리지 않게 내 귀속에 눈물만 채우고 있어 비라도 내리면 하늘을 가려서 니 모습 볼수 없을것만 같았지 하지만 비에 젖어도 씻을수 없는게 있어 너와 함께 했던 빗속의 추억 하늘아 들리지 않니 간절한 내 기도 소리 그녀를 데려갔으면 추억도 가져갈 순 없니 하늘아 제발 도와줘 나에게 남은 사랑도 모두다 그녀에게 보낼 수 있게,"1,014",1998,R.ef,The Deaf Sky,A♭ Minor,1A,139.0,4:20,18.0,95.0,62.0,49.0,11.0,3.0,18.0,5.0,-7 dB,1998
77,신승훈 고개숙인 너에게,고개숙인 너에게,신승훈,발라드,말해줄수 없겠니 힘겨워 하지말고 더이상 무너지는 너를 난 볼수없어 친구라는 이유로 너를 위로하지만 감출수가 없던지 너의 흐르는 눈물 지켜주소서 내앞의 나의 친구를 약해진 모습 난 해줄말이 없군요 너무 힘들어 내 품에 기대였을때 너의 뜨거운 눈물 내 가슴에 느껴져 I Can Feel It 울지마 아직 우리에겐 지나간 날보다 남은 날이 더 많아 무릎 꿇지마라 그대여 이세상 끝에서 함께 웃는 날까지  지켜주소서 내앞의 나의 친구를 약해진 모습 난 해줄말이 없군요 너무 힘들어 내 품에 기대였을때 너의 뜨거운 눈물 내 가슴에 느껴져 I Can Feel It 울지마 아직 우리에겐 지나간 날보다 남은 날이 더 많아 무릎 꿇지마라 그대여 이세상 끝에서 함께 웃는 날까지  아무도 널 대신 살아 줄순 없는거야 고개를 들어서 너의 하늘을 바라봐 다시 시작하는 거야  울지마 아직 우리에겐 지나간 날보다 남은 날이 더 많아 무릎 꿇지마라 그대여 이세상 끝에서 함께 웃는 날까지 울지마 아직 우리에겐 지나간 날보다 남은 날이 더 많아 무릎 꿇지마라 그대여 이세상 끝에서 함께 웃는 날까지,"11,281",1998,Shin Seung Hun,Mourning You (2024 Remaster),C Major,8B,132.0,5:34,1.0,52.0,70.0,33.0,25.0,0.0,11.0,3.0,-6 dB,1998
78,자우림 밀랍천사,밀랍천사,자우림,록/메탈,오늘밤 너는 너무 근사해 보여 너무 행복해 보여 너무 오늘밤 너를 그냥 둔다면 너를 그냥 둔다면 말도 안돼 아우 네 빨간 입술에 입 맞출꺼야 오늘 말해 줄꺼야 오늘 다시는 보내지 않을꺼야 너를 보내지 않을꺼야 너를 차가운 너는 나만의 천사 나만의 것 숨쉬지 않아도 좋아 예예 싸늘한 너는 나만의 연인 나만의 것 말하지 않아도 좋아 예예예예 오늘밤 너는 너무 완벽해 보여 너무 행복해 보여 너무 오늘밤 내게 안겨 웃어봐 내게 안겨 춤춰봐 내게 안겨 아우 차가운 니 피부 널 만지고 싶어 만지고 싶어 싸늘한 눈동자 널 가지고 싶어 가지고 싶어 차가운 너는 나만의 천사 나만의 것 숨쉬지 않아도 좋아 예예 싸늘한 너는 나만의 연인 나만의 것 말하지 않아도 좋아 예예예예 차가운 너는 나만의 천사 나만의 것 숨쉬지 않아도 좋아 예예 싸늘한 너는 나만의 연인 나만의 것 말하지 않아도 좋아 예예예예 오늘밤 너는 너무 근사해 보여 너무 행복해 보여 너무 오늘밤 너를 그냥 둔다면 너를 그냥 둔다면 말도 안돼 아우 차가운 너는 나만의 천사 나만의 것 숨쉬지 않아도 좋아 예예 싸늘한 너는 나만의 연인 나만의 것 말하지 않아도 좋아 예예예예 차가운 너는 나만의 천사 나만의 것 숨쉬지 않아도 좋아 예예 싸늘한 너는 나만의 연인 나만의 것 말하지 않아도 좋아 예예예예 차가운 너는 나만의 천사 나만의 것 숨쉬지 않아도 좋아 예예 싸늘한 너는 나만의 연인 나만의 것,"39,263",1998,JAURIM,Beeswax Angel,D Major,10B,122.0,3:53,18.0,91.0,63.0,89.0,0.0,0.0,18.0,4.0,-6 dB,1998
79,H.O.T. 열맞춰! (Line Up!),열맞춰! (Line Up!),H.O.T.,댄스,한마디 예고 없이 잘라버리고 내 인생 좀 바꿔주오 그대들 바라는 것이라면 말 잘 듣는 Puppet가 돼도 좋아 짜놓은 각본대로 그렇게 어디 한번 잘 되나 지켜봅시다 Uh Yeah Here comes the HOT I'm not not not not I'm not a fool Sock it HOT 날 버리겠죠 그렇죠 몽땅 쓸어버리겠죠 한심한 꼬라지들 구제불능아라고 자기들 같이 잘난 사람되라고 어쩌고 저쩌고 지지고 짜지고 떠들어대는 껍데기들 난 그게 싫어 하나도 보고 배울 것이 없는 그대들 재미없어 없어 자신을 바라봐 모두 똑같은 크기의 젓가락 행진일 뿐이야 uh 공수래 공수거 바람처럼 부질없는 것 왜 다들 그렇게 잡지도 못할 걸 쫓고 있나 공수래 공수거 거품처럼 사그러질 것들 욕심을 버리고 하늘을 봐 그대를 노려보는 눈이 느껴지는가 넌 가끔 나에게 왜 그리 밑바닥을 기며 사느냐고 저질이라고 때론 불쌍하다고 그런 눈으로 woo 보지마 쳐다보지마 왜 왜 니 기준보다 서너 가지 모자라면 하등인간인가 대 그리 대체 그 기준 법은 누가 만들었을까 절망과 한숨밖에 내 가슴속에 남는 건 없었지 오직 이 땅에 내가 살아 남과 다른 날 찾고 싶었어 케캐묵은 권위 명예와 돈과 욕심 많은 것들 바꿔야 해 자기 것만 알고 남은 짓밟고 다 내꺼 다 내꺼 1등 아니면 다 안된다는 생각 2등부터 고개 들지도 마 이제 모든 굴레 벗어나고 싶어 숨막혀 열 맞춰 무조건 억제하고 다그치고 열 맞춰 낙오하면 버림받고 열 맞춰 모든 개성들은 잘라버려 열 맞춰 Ah 모두가 꿈꾸었던 세상 어느 누구도 지배하게 둘 수 없어 인간을 재는 기준과 잣대는 모두 없어져버려 uh 공수래 공수거 바람처럼 부질없는 것 왜 다들 그렇게 잡지도 못할 걸 쫓고 있나 공수래 공수거 거품처럼 사그러질 것들 욕심을 버리고 하늘을 봐 그대를 노려보는 눈이 느껴지는가,"17,580",1998,H.O.T.,Line Up!,B Minor,10A,170.0,4:10,24.0,84.0,46.0,54.0,4.0,0.0,20.0,38.0,-4 dB,1998
80,엔알지 (NRG) 할 수 있어,할 수 있어,엔알지 (NRG),댄스,할 수 없어 널 사랑한다는 말 또 널 그리워 한단 말 니 주위에서 난 항상 맴돌고 있어 니 앞에선 땅만 쳐다보고 있어 고개도 들 수 없어 단 한 번의 내 첫사랑을 위해서 오 내 맘을 전해줘 누구라도 내가 여기 서 있겠다 해줘 빠라빠라 너를 누구보다 아껴줄 내가 여기 있어 빠라빠라 니가 나를 사랑할 때까지 그 때까지 널 기다릴수 있을 때까지 너무나 힘들어 쓰러질 때까지 널 원할 때까지 그 때까지 받아줘 니 안에 있게해줘 울리지 말아줘 나를 그저 너의 옆에서만 같이 있게 해줘 언제쯤 내 맘을 넌 알아줄까 너 언제쯤 나를 애타게 안할까 우리는 우연일까 아니 필연 일꺼야 나를 사랑한다 해 할 수 없어 널 사랑한다는 말 또 널 그리워 한단 말 니 주위에서 난 항상 맴돌고 있어 니 앞에서 땅만 쳐다보고 있어 고개도 들 수 없어 단 한 번의 내 첫사랑을 위해서 이렇게 평생을 너와 보낼 수 있으면 좋겠어 슬픔은 나눌 수 있고 기쁨은 배로 함께 할 수 있잖아 언제쯤 내 맘을 넌 알아줄까 너 언제쯤 나를 애타게 안할까 우리는 우연일까 아니 필연 일꺼야 나를 사랑한다 해 할 수 없어 널 사랑한다는 말 또 널 그리워한단 말 니 주위에서 난 항상 맴돌고 있어 니 앞에서 땅만 쳐다보고 있어 고개도 들 수 없어 단 한 번의 내 첫사랑을 위해서 어떻게 해 나를 도와줄 사람 또 그녀에게 전해줄 날 도와줘 끝나지 않게 해줘 내 마음을 그녀에게 전해 단 한번의 내 첫사랑을 위해서,"1,290",1998,NRG,할 수 있어,C Major,8B,150.0,4:06,28.0,94.0,67.0,79.0,1.0,0.0,26.0,6.0,-6 dB,1998
81,여명 사랑한 후에 (내 마음을 뺏어 봐),사랑한 후에 (내 마음을 뺏어 봐),여명,-,여러번 널 단념하려했어 내 하루는 온통 너뿐이지만 누군갈 혼자 사랑해봤던 사람은 내 맘 다 알거야  오늘인지 내일인지 모를 이별 앞에 난 서있는 것 같아 함께라고 느끼는 순간도 네 맘을 가질순 없잖아  듣고싶어 너를 기다려달란말 조금씩 내게 마음을 열어 지금 나의 슬픔 괜찮아 내가 너의 마지막 사랑이라면  여러번 널 단념하려했어 내 하루는 온통 너뿐이지만 누군갈 혼자 사랑해봤던 사람은 내 맘 다 알거야  듣고싶어 너를 기다려달란말 조금씩 내게 마음을 열어 지금 나의 슬픔 괜찮아 내가 너의 마지막 사랑이라면,343,1998,"twlv, Paul Blanco",No More(feat.Paul Blanco),C# Minor,12A,101.0,3:10,13.0,63.0,71.0,16.0,3.0,0.0,56.0,4.0,-6 dB,1998
82,H.O.T. 빛 (Hope),빛 (Hope),H.O.T.,댄스,늘 함께 있어 소중한 걸 몰랐던 거죠 언제나 나와 함께 있어준 소중한 사람들을 가끔씩 내가 지쳐 혼자라 느낄 때 언제나 내게 힘이 돼준 사람들을 잊고 살았죠 이제는 힘들어도 지쳐도 쓰러지지 말고 당신의 내일을 생각하며 일어나요 사업에 실패 했어 사랑에 실패 했어 그 어떤 것도 당신을 쓰러 뜨릴순 없어 알고있죠 세상엔 당신 혼자가 아니란 걸 주저앉아 슬퍼만 하고 있을 때가 아니란 걸 아는걸 우리모두 일어나요 손을 내밀어요 모두 다함께 해요 다함께 손을 잡아요 그리고 하늘을 봐요 우리가 함께 만들 세상을 하늘에 그려봐요 눈이 부시죠 너무나 아름답죠 마주잡은 두 손으로 우리 모두 함께 만들어 가요 워워 baby 어둠에 둘러싸인 세상이 그 속에 쓰러져 가는 모두들의 모습이 우리 마음속에 있는 믿음과 사랑이 크지 못하게 가로막고 있다고 해도 다시 시작할 수 있는 굳은 용기 일어설 수 있다는 걸 알고 있어 눈물을 닦고서 밝아 오는 빛을 맞이하며 높이 우뚝 선 모두들의 행복한 미소를 그려 주위를 둘러보면 너무나 가슴이 아프죠 세상에 가득 차 있는 미움과 아픔들이 나를 서로를 미워하는 그런 마음들을 조금만 가슴을 열어 우리 서로의 사랑을 나누어 봐요 우리가 서로에게 조금씩 사랑을 보일 때 서로에 대한 믿음을 키워나갈 때 싸울 일 없어 기분 나쁠 일도 없어 서로 찡그리며 다툴 필요도 전혀 없어 우리가 꿈꾸는 눈부신 빛이 저기 있어 아름다운 세상이 바로 저기 보여 우린 여기 서서 이렇게 말하고 있어 우린 H O T Let's Party 다함께 손을 잡아요 그리고 하늘을 봐요 우리가 함께 만들 세상을 하늘에 그려봐요 눈이 부시죠 너무나 아름답죠 마주잡은 두 손으로 우리 모두 함께 만들어 가요 워워 baby 앞으로 열릴 당신의 날들을 환하게 비춰줄 수 있는 빛이 되고 싶어 이제 고개를 들어요 눈부신 빛을 바라봐요 다함께 손을 잡아요 그리고 하늘을 봐요 우리가 함께 만들 세상을 하늘에 그려봐요 눈이 부시죠 너무나 아름답죠 마주잡은 두 손으로 우리 모두 함께 만들어 가요 모두 다 눈을 떠봐요 눈앞에 세상을 봐요 꼭 마주잡은 두 손으로 우리가 해냈어요 두려움은 없어요 슬픔도 이젠 없어 우리 마음을 여기에 모아 기쁨의 축제를 열어요,"17,580",1998,H.O.T.,Hope,C Major,8B,100.0,4:21,43.0,97.0,65.0,73.0,6.0,0.0,14.0,9.0,-4 dB,1998
83,유승준 내가 기다린 사랑,내가 기다린 사랑,유승준,댄스,니가 미웠어 날 몰라주는 너 또 말도못해 안달하는 나도 미웠어 난 언제나 널보면 가슴시린 설레임뿐인데 너는 그렇지가 않았어 야속했었어 세상에서 가장이쁜 널 다 가지고 싶었어 난 그렇게 널 보며 매일매일 가슴만 졸이는 짝사랑 되어버렸어 정말 궁금해 날보는 너의 마음이 그냥 친구처럼 편하게만 느끼는걸까 너의 눈빛만 보아도 떨리는 나를 이제 더 이상은 감출수 없어 이런 내마음 알게 된다면 오히려 부담되어 멀어질까 걱정만앞서 조금만 더 기다려볼까 너먼저 사랑으로 다가오기를 하지만 겁이나 힘겨운 기다림 속에 다른 누군가가 너의사랑 돼버릴까봐 너를 영원히 내곁에 두고싶지만 사랑뒤에 이별 그게 두려워 I'm waiting for your love my darling don't you want to love me tonight I'm waiting for you live my darling I can make you feel just night 결국 하늘도 무심하지 날 버려둔채 넌 다른남잘 만나 사랑을 했어 그때 널 잊고 돌아서야 했는데 그럴 용기도 없었던거야 그랬던거야 넌 잔인하게 너의 사랑얘기를 나에게 들려준거야 널웃게 했던 사랑 날울게 했던 이별 난 그걸 모두 참으며 나를 지켰어 너의 몇번의 이별을 바라 보면서 아직 내 사랑은 모질게도 잘 견뎌왔어 말도 못한채 상처만 키워 오면서 끝내 너의자린 비워 둔거야 그 언젠가 비내리던 밤 넌 내게 찾아와서 또 이별에 눈물흘렸지 내 품에서 약속을 했지 나만은 널 버리고 가지 말라고 누구도 다시는 사랑을 하지 못하게 너의 사랑 내게 맡겨두면 어떻겠냐고 너무 길어진 기다림 후회는 없어 이젠 이별이란 없을테니까 걱정마 약속해 행복한 사랑보다는 이별없는 사랑 그것만은 지킬테니까 내게 기대봐 화려한 사랑보다는 친구처럼 편한 휴식을 줄게 왜 그랬는지 왜 기다렸는지 누가 봐도 비난하고 원망할거야 왜 처음부터 나만의 너를 만들지를 못했냐고 나역시 후회하지만 그랬었나봐 내가원한 사랑이란 그때의 니모습이 아니었나봐 내 한결같은 사랑 네 변치않을 영혼 니 곁에서만 살기를 바랬었나봐,"2,591",1998,Steve Yoo,The Love I Have Been Waiting for,E Minor,9A,114.0,3:35,30.0,97.0,80.0,69.0,14.0,0.0,22.0,7.0,-4 dB,1998
