,artist_song,song_x,artist_x,genre,lyric,like,year_x,artist_y,song_y,key,camelot,bpm,duration,popularity,energy,danceability,happiness,acousticness,instrumentalness,liveness,speechiness,loudness,year_y
18,안치환 사람이 꽃보다 아름다워,사람이 꽃보다 아름다워,안치환,포크/블루스,헤이 헤이 강물같은 노래를 품고 사는 사람은 알게되지 음 알게되지 내내 어두웠던 산들이 저녁이되면 왜 강으로 스미어 꿈을 꾸다 밤이 깊을수록 말없이 서로를 쓰다듬으며 부둥켜안은채 느긋하게 정들어 가는지를 으음 음 지독한 외로움에 쩔쩔매본 사람은 알게되지 음 알게되지 그슬픔에 굴하지 않고 비켜서지 않으며 어느결에 반짝이는 꽃눈을 닫고 우렁우렁 잎들을 키우는 사랑이야말로 짙푸른 숲이되고 산이되어 메아리로 남는다는 것을 누가 뭐래도 사람이 꽃보다 아름다워 이 모든 외로움 이겨낸 바로 그사람 누가 뭐래도 그대는 꽃보다 아름다워 노래의 온기를 품고사는 바로 그대 바로 당신 바로 우리 우린 참사랑 지독한 외로움에 쩔쩔매본 사람은 알게되지 음 알게되지 그슬픔에 굴하지 않고 비켜서지 않으며 어느결에 반짝이는 꽃눈을 닫고 우렁우렁 잎들을 키우는 사랑이야말로 짙푸른 숲이되고 산이되어 메아리로 남는다는 것을 누가 뭐래도 사람이 꽃보다 아름다워 이 모든 외로움 이겨낸 바로 그사람 누가 뭐래도 그대는 꽃보다 아름다워 노래의 온기를 품고사는 바로 그대 바로 당신 바로 우리 우린 참사랑 누가 뭐래도 사람이 꽃보다 아름다워 노래의 온기를 품고사는 바로 그대 바로 당신 바로 우리 우린 참사랑,"2,640",1998,안치환,사람이 꽃보다 아름다워,E Major,12B,121.0,4:48,25.0,77.0,69.0,67.0,53.0,0.0,12.0,5.0,-8 dB,1998
19,강산에 거꾸로 강을 거슬러 오르는 저 힘찬 연어들처럼,거꾸로 강을 거슬러 오르는 저 힘찬 연어들처럼,강산에,록/메탈,흐르는 강물을 거꾸로 거슬러 오르는 연어들의 도무지 알 수 없는 그들만의 신비한 이유처럼 그 언제서 부터인가 걸어 걸어 걸어 오는 이 길 앞으로 얼마나 더 많이 가야만 하는지 여러 갈래길 중 만약에 이 길이 내가 걸어 가고 있는 돌아서 갈 수 밖에 없는 꼬부라진 길일지라도 딱딱해지는 발바닥 걸어 걸어 걸어 가다보면 저 넓은 꽃밭에 누워서 난 쉴 수 있겠지 여러 갈래길 중 만약에 이 길이 내가 걸어 가고 있는 막막한 어둠으로 별빛조차 없는 길 일지라도 포기할순 없는거야 걸어 걸어 걸어 가다보면 뜨겁게 날 위해 부서진 햇살을 보겠지 그래도 나에겐 너무나도 많은 축복이란걸 알아 수없이 많은 걸어 가야할 내 앞길이 있지 않나 그래 다시 가다보면 걸어 걸어 걸어 가다보면 어느날 그 모든 일들을 감사해 하겠지 보이지도 않는 끝 지친어깨 떨구고 한숨짓는 그대 두려워 말아요 거꾸로 강을 거슬러 오르는 저 힘찬 연어들처럼 걸어가다 보면 걸어가다 보면 걸어가다 보면,"4,049",1998,Kang San-Eh,거꾸로 강을 거슬러 오르는 저 힘찬 연어들처럼,E♭ Major,5B,96.0,4:41,35.0,85.0,68.0,83.0,25.0,0.0,12.0,5.0,-7 dB,1998
20,김광진 진심,진심,김광진,발라드,그렇게 화내지 마요 그 말은 진심이 아니죠 이해를 할 수 없다면 그저 웃어 넘긴다면 어때요 그래도 잊진 말아요 그대의 소중한 재능이 숨겨진 보석과 같은거죠 언젠간 환하게 빛날테죠 꿈만큼 이룰꺼에요 너무 늦었단 말은 없어요 그대를 지켜주는 건 그대 안에 있어요 강해져야만 해요 그것만이 언제나 내 바램이죠 이 세상 사는 동안에 수많은 사람을 만나고 또 헤어지게 되겠죠 허나 이런 느낌 다시 없을테죠 영원히 사랑하기에 나의 모든 걸 다 준다해도 그대를 지켜주는 건 그대 안에 있어요 강해져야만 해요 그것만이 언제나 내 바램이죠 떠나갈 때가 오나요 그대 힘든 길을 가는 동안 이것만 기억해줘요 그대 사랑하지요 세상 그 무엇보다 그대만을 영원히 나 기다려요,"3,410",1998,Kim Kwangjin,Truly,C# Major,3B,138.0,4:07,16.0,34.0,49.0,29.0,82.0,0.0,8.0,3.0,-6 dB,1998
21,S.E.S. ('Cause) I'm Your Girl,('Cause) I'm Your Girl,S.E.S.,댄스,Yeah what's up what's up SES We open up the new chapter of funky New jill swing Here we come Here we come come on I like SES ya'll Yes SES ya'll we like SES ya'll Yes SES ya'll You never don't stop you never don't quit Kick out some sounds of the Hip hop bear Now dap your hands everybody Now move your feet every body to the left to the left to the right to the right now bring it back fat rhythm of the free style 왜 내게 말을 못해 이미 지나간 일들 진부한 옛 사랑 얘기 I love you tell me baby 솔직히 말을 해줘 그렇지만 너에겐 오직 나뿐인 거야 oh yeah 두려워 하지마 내 곁에 있는걸 그대와 내 인생 저 끝까지 나를 믿어주길 바래 함께있어 Cause I'm your girl Hold me baby 너를 닮아가는 내 모습을 지켜봐줘 stay with me last forever yeah 넌 왠지 달랐었지 느낌이 예전부터 알고 지낸 친구처럼 shake it shake it baby 그렇게 너는 내게 해맑은 웃음만을 주는 또 하나의 나 두려워 하지마 네 옆에 있는걸 난 오직 너를 위해 살고 싶어 나를 향한 네 모든걸 간직할께 Cause I'm your girl Hold me baby 너를 닮아가는 내 모습 지켜봐줘 Stay with me last forever 몰랐어 난 나 너에게 있어 그 어느 하나 자신있게 얘기할 수 없었던 것 모두 부질없는 내 걱정이었다니 이제 널 나의 품에 꼭 안아줄게 난 널 몰랐던거야 오직 너 하나 하나를 위해 내가 살아가야 한다는 것말고 내게 중요한 게 어딨겠어 이젠 네가 알아주길 바랬어 너에겐 그 어떤 말보다 넌 내꺼라는 말이 듣고 싶어 사랑해 언제까지나 baby you always in my heart 나를 믿어주길 바래 함께있어 Cause I'm your girl Hold me baby 너를 닮아가는 내 모습 지켜봐줘 Stay with me last forever yeah 나를 향한 네 모든걸 간직할께 Cause I'm your girl Hold me baby 너를 닮아가는 내 모습 지켜봐줘 Stay with me last forever yeah,"11,928",1998,S.E.S.,(′Cause) I′m Your Girl,B♭ Minor,3A,102.0,3:46,45.0,91.0,76.0,73.0,12.0,0.0,28.0,9.0,-4 dB,1998
22,리아 난 그래,난 그래,리아,록/메탈,누구나 사랑을 말하지 마치 모든 걸 아는 사람처럼 모두들 쉽게만 말하지 마치 해답을 아는 것처럼 생각만 해도 좋은 것 때론 가슴이 찢어지는 것 처음 같을 순 없지만 그래도 한번은 해보고 싶은 것 오헤이 예 하지만 난 알아 뭐라 해도 나만큼만 날 사랑해주면 되는 걸 내가 너의 모든 것이 될 순 없어도 날 사랑할 땐 헤이예 하나만 약속해 뭐라 해도 나만큼만 날 사랑해 주겠다는 걸 어떤 것도 믿음만큼 중요친 않아 처음 본 순간 가는 것 세상 모든 걸 대신 하는 것 하지만 그런 생각은 시간이 흐르면 바랠지도 몰라 오헤이 예 하지만 난 알아 뭐라 해도 나만큼만 날 사랑해주면 되는 걸 내가 너의 모든 것이 될 순 없어도 날 사랑할 땐 헤이예 하나만 약속해 뭐라 해도 나만큼만 날 사랑해 주겠다는 걸 어떤 것도 믿음만큼 중요친 않아 난 그래 오래된 연인의 사랑은 믿음으로 변한다고들 해 쉬운 사랑만을 찾지마 지킬 수 있는 용기가 필요해,704,1998,RIAA,난 그래,F Major,7B,182.0,3:55,2.0,82.0,59.0,64.0,17.0,2.0,31.0,7.0,-6 dB,1998
23,소찬휘 보낼수밖에 없는 난,보낼수밖에 없는 난,소찬휘,발라드,떠나는 모습까진 볼 수 없어요 꼭 그래야 할 필요없다면 차라리 내가 먼저 돌아서는게 서로를 위해 좋을것 같아 난 준비가 되지 않아서 흐르는 눈물일 뿐이예요 나를 편하게 떠나요 어차피 돌이킬 수 없다면 오 보내야겠지 떠나고 싶어 떠나는 건 이해해야지 오 하지만 다신 내가 볼 수 없는 먼 곳으로 떠나줬으면 해 날 사랑한다던 그 말도 그대의 따스한 그 숨결도 모두 잊어야 하기에 조금은 힘이 들것 같지만 오 보내야겠지 떠나고 싶어 떠나는 건 이해해야지 오 하지만 다신 내가 볼 수 없는 먼 곳으로 떠나줬으면 해 마지막 남은 마음으로 그댈 잡아보고 싶지만 난 보내야겠지 돌아오기엔 너무 멀리 가고 있잖아 오 참아야겠지 함께한 시간이 짧기에 그댈 잊을 수 있겠지 하루종일 그대 생각만하네요 솔직히 너무 두려워져요 함께한 시간이 짧다 믿었는데 이제와 보니 아닌 것 같아,"3,483",1998,ATEEZ,Crazy Form,F Minor,4A,119.0,3:18,70.0,79.0,83.0,47.0,3.0,0.0,34.0,5.0,-5 dB,1998
24,에코 행복한 나를,행복한 나를,에코,발라드,몇 번인가 이별을 경험하고서 널 만났지 그래서 더 시작이 두려웠는지 몰라 하지만 누군가 알게되고 사랑하게 되는건 네가 마지막이라면 얼마나좋을까 우 나처럼 바쁜 하루중에도 잠시 네 목소리 들으면 함께있는 것처럼 너도 느껴지는지 매일 밤 집으로 돌아갈 때 그 곳에 네가 있다면 힘든하루 지친 네 마음이 내 품에 안겨 쉴텐데 지금처럼만 날 사랑해줘 난 너만 변하지 않는다면 내 모든걸 가질 사람은 너뿐이야 난 흔들리지 않아 넌 가끔은 자신이 없는 미래를 미안해 하지만 잊지 말아줘 사랑해 너와 함께라면 이젠 행복한 나를 바쁜 하루중에도 잠시 네 목소리 들으면 함께있는 것처럼 너도 느껴지는지 매일 밤 집으로 돌아갈 때 그 곳에 네가 있다면 힘든하루 지친 네 마음이 내 품에 안겨 쉴텐데 지금처럼만 날 사랑해줘 난 너만 변하지 않는다면 내 모든걸 가질 사람은 너뿐이야 난 흔들리지 않아 넌 가끔은 자신이 없는 미래를 미안해 하지만 잊지말아줘 사랑해 너와 함께라면 이젠 행복한 나를 난 많은 기대들로 세상이 정해놓은 사랑을 버리고 네 마음처럼 난 늘 같은 자리에 또 하나의 네가 되고싶어 소중한 널 위해 지금처럼만 사랑해줘 항상 너만 변하지 않으면 내 전부를 가질 사람은 너뿐이야 난 흔들리지 않아 자신없는 미래 넌 미안해 하고 있니 넌 이제 혼자가 아니야 이젠 잊지마 너와 함께라면 언제나 행복한 나를,699,1998,Eco,Happy me,F Major,7B,132.0,4:38,37.0,55.0,75.0,39.0,46.0,0.0,19.0,3.0,-8 dB,1998
25,신해철 일상으로의 초대 (Radio Mix),일상으로의 초대 (Radio Mix),신해철,록/메탈,산책을 하고 차를 마시고 책을 보고 생각에 잠길 때 요즘엔 뭔가 텅 빈 것 같아 지금의 난 누군가 필요한 것 같아 친굴 만나고 전화를 하고 밤새도록 깨어있을 때도 문득 자꾸만 네가 생각나 모든 시간 모든 곳에서 난 널 느껴 내게로 와 줘 내 생활 속으로 너와 같이 함께라면 모든게 새로울거야 매일 똑같은 일상이지만 너와 같이 함께라면 모든게 달라질거야 서로에 대해 거의 모든 걸 지켜보며 알게 된다는게 말처럼 그리 쉽지 않겠지 그렇지만 난 준비가 된 것 같아 너의 대답을 나 기다려도 되겠니 난 내가 말할 때 귀 기울이는 너의 표정이 좋아 내 말이라면 어떤 거짓 허풍도 믿을 것 같은 그런 진지한 얼굴 네가 날 볼 때마다 난 내 안에서 설명할 수 없는 기운이 느껴져 네가 날 믿는 동안엔 어떤 일도 해낼 수 있을 것 같은 기분이야 이런 날 이해하겠니 내게로 와 줘 내게로 와 줘 내 생활 속으로 너와 같이 함께라면 모든게 새로울거야 매일 똑같은 일상이지만 너와 같이 함께라면 모든게 달라질거야 I'm spending whole my days for you Cause I am always thinking about you I really like to share my life with you I truely want to be someone for you So It is an invitaion to you Now I am waiting for the answer from you I swear I will do anything for you But sadly I've got nothing to give you All I can do is just say I love you 해가 저물면 둘이 나란히 지친 몸을 서로에 기대며 그 날의 일과 주변 일들을 얘기하다 조용히 잠들고 싶어,"16,731",1998,Shin Hae Chul,일상으로의 초대 - Radio Mix,F Minor,4A,130.0,5:23,12.0,61.0,65.0,67.0,49.0,0.0,7.0,3.0,-7 dB,1998
26,이현우 헤어진 다음날,헤어진 다음날,이현우,발라드,그대 오늘 하루는 어땠나요 아무렇지도 않았나요 혹시 후회하고 있진 않나요 다른 만남을 준비하나요 사랑이란 아무나 할 수 있는게 아닌가 봐요 그대 떠난 오늘 하루가 견딜 수 없이 길어요 날 사랑했나요 그것만이라도 내게 말해줘요 날 떠나가나요 나는 아무것도 할 수 없어요 어제 아침에 이렇진 않았어요 아무렇지도 않았어요 오늘 아침에 눈을 떠보니 모든 것이 달라져 있어요 사랑하는 마음도 함께 가져갈 수는 없나요 아무 일도 없던 것처럼 돌아올 수는 없나요 날 사랑했나요 그것만이라도 내게 말해줘요 날 떠나가나요 나는 아무것도 할 수 없어요 날 사랑했나요 그것만이라도 내게 말해줘요 날 떠나가나요 나는 아무것도 할 수 없어요 날 사랑했나요 그것만이라도 내게 말해줘요 날 떠나가나요 나는 아무것도 할 수 없어요,788,1998,이현우,헤어진 다음날,E♭ Major,5B,152.0,4:47,22.0,83.0,47.0,54.0,8.0,0.0,39.0,7.0,-6 dB,1998
27,패닉 내 낡은 서랍 속의 바다,내 낡은 서랍 속의 바다,패닉,록/메탈,내 바다 속에는 깊은 슬픔과 헛된 고민들 회오리치네 그 바다 위에선 불어닥치는 세상의 추위 맘을 얼게 해 때로 홀로 울기도 지칠 때 두눈 감고 짐짓 잠이 들면 나의 바다 그 고요한 곳에 무겁게 내려가 나를 바라보네 난 이리 어리석은가 한치도 자라지 않았나 그 어린 날의 웃음을 잃어만 갔던가 초라한 나의 세상에 폐허로 남은 추억들도 나 버릴 수는 없었던 내 삶의 일부인가 나 어릴 적 끝도 없이 가다 지쳐버려 무릎 꿇어버린 바다 옛날 너무나도 고운 모래마다 이젠 모래 위에 깊은 상처 하나 행복하고 사랑했던 그대와 나 생각만으로 웃음짓던 꿈도 많아 그런 모든 것들 저 큰 파도에 몸을 맡겨 어딘가 가더니 이젠 돌아오지 않아 바다 앞에 내 자신이 너무 작아 흐르는 눈물 두 손 주먹 쥐고 닦아 많은 꿈을 꾸었는대 이젠 차마 날 보기가 두려워서 그냥 참아 그 때 내가 바라보던 것들 아마 볼 수 없겠지만 그래도 눈을 감아 나의 낡은 서랍 속의 깊은 바다 이젠 두 눈 감고 다시 한 번 닫아 때로 홀로 울기도 지칠 때 두눈 감고 짐짓 잠이 들면 나의 바다 그 고요한 곳에 무겁게 내려가 나를 바라보네 난 이리 어리석은가 한치도 자라지 않았나 그 어린 날의 웃음을 잃어만 갔던가 초라한 나의 세상에 폐허로 남은 추억들도 나 버릴 수는 없었던 내 삶의 일부인가 나 어릴 적 끝도 없이 가다 지쳐버려 무릎 꿇어버린 바다 옛날 너무나도 고운 모래마다 이젠 모래 위에 깊은 상처 하나 행복하고 사랑했던 그대와 나 생각만으로 웃음짓던 꿈도 많아 그런 모든 것들 저 큰 파도에 몸을 맡겨 어딘가 가더니 이젠 돌아오지 않아 바다 앞에 내 자신이 너무 작아 흐르는 눈물 두 손 주먹 쥐고 닦아 많은 꿈을 꾸었는대 이젠 차마 날 보기가 두려워서 그냥 참아 그 때 내가 바라보던 것들 아마 볼 수 없겠지만 그래도 눈을 감아 나의 낡은 서랍 속의 깊은 바다 이젠 두 눈 감고 다시 한 번 닫아,"6,027",1998,Panic,내 낡은 서랍 속의 바다,D Major,10B,95.0,6:23,23.0,67.0,36.0,41.0,62.0,2.0,21.0,5.0,-9 dB,1998
28,진주 Everybody,Everybody,진주,댄스,스뜹뜨르르듭듭듭 Oh baby 즐거운 리듬에 맞춰 우리 흥겨운 리듬에 맞춰 스뜹뜨르르듭듭듭 Woo Uhh 즐거운 리듬에 맞춰 우리 흥겨운 리듬에 맞춰 학교 가면 선생님의 눈치를 봐 집에 돌아오면 다시 부모님의 눈치를 봐 졸업하고 취직해도 직장 상사의 눈치를 봐 이건 대체 살 수가 없네 이럴 땐 Everybody 스뜹뜨르르듭듭듭 우리 모두 여기 모여 즐거운 리듬에 맞춰 우리 흥겨운 리듬에 맞춰 스뜹뜨르르듭듭듭 모든 걸 잊고서 즐거운 리듬에 맞춰 우리 흥겨운 리듬에 맞춰 버스를 타면 사람들이 너무 많아 지하철을 탔는데도 사람들이 너무 많아 시험 보러 가면 경주용 차들이 너무 너무 많아 건 대체 살 수가 없네 이럴 땐 Everybody 스뜹뜨르르듭듭듭 우리 모두 여기 모여 즐거운 리듬에 맞춰 우리 흥겨운 리듬에 맞춰 스뜹뜨르르듭듭듭 모든 걸 잊고서 즐거운 리듬에 맞춰 우리 흥겨운 리듬에 맞춰 눈 감아봐 그리고 느껴봐 음악에 몸을 싣고 모든 걸 잊고 이렇게 흔들어 봐 Hey mama C'mon Break it down 우리 모든 근심 걱정들을 잊고 우리 모두 이렇게 모두 가슴을 열고 그리고 이렇게 춤을 춰 어떻게 춤을 춰 그런거 묻지 말고 모두 춤을 춰 자 하나 둘 자 모두들 어깨를 이렇게 움직여봐들 자 셋 넷 거기 줄리엣 여기 로미오가 그대를 바라보네 이렇게 언제나 즐거운 마음으로 살아가려는 사람들은 모두 다 내 곁으로 마음 속에 그려보던 우리들만의 세상으로 이젠 다 함께 떠나가봐요 이럴 땐 Everybody 스뜹뜨르르듭듭듭 우리 모두 여기 모여 즐거운 리듬에 맞춰 우리 흥겨운 리듬에 맞춰 스뜹뜨르르듭듭듭 모든 걸 잊고서 즐거운 리듬에 맞춰 우리 흥겨운 리듬에 맞춰 스뜹뜨르르듭듭듭 우리 모두 여기 모여 즐거운 리듬에 맞춰 우리 흥겨운 리듬에 맞춰 스뜹뜨르르듭듭듭 Woo Huh 즐거운 리듬에 맞춰 우리 흥겨운 리듬에 맞춰 Not Stop,"1,003",1998,진주,Everybody,G Major,9B,106.0,3:25,2.0,89.0,87.0,85.0,8.0,0.0,15.0,4.0,-4 dB,1998
29,비쥬 Love Love,Love Love,비쥬,발라드,"We will forever I love you. you will never knew baby  그다지 화려한 세상은 아니지만 언제나 내가 너만을 위해 꿈꾸어 왔던 나만의 세상이 있어 우~  수정처럼 맑은 너의 미소를 내게 보여줘 너의 마음속에 내가 들어갈 수 있도록 눈처럼 하얀 너의 미소를 내게 보여줘 너를 위한 내 마음이 영원할 수 있게  너를 만나기 전에 언제나 내 자신만을 믿어왔어 그래 난 화려하게 살고 싶었어 그 속에 행복이 있다고 믿었 지 그 니가 너만의 너만의 꿈을 이룰 수 있게 하늘을 나는 방 법을 가르쳐 줄께 세상의 진정한 행복은 언제나 내 맘 속에 있는 거야  어둠 속에 니가 지쳐 혼자 걸어갈 때도 널 위한 내 마음이 너를 지켜줄거야  Toi, c'est tres complique Mais il est fou d'etre Trop raisonnable moi L'amour, c'est plus fort que J'ai besoin de toi  (아주 가끔 따사로운 햇살이 너의 어깨를 비추는 이른 아침에도 나를 또 하나의 너로 생각해 줄 수 있는지...)",824,1998,Bijou,Love Love,G Major,9B,98.0,3:43,34.0,68.0,74.0,61.0,6.0,0.0,33.0,3.0,-5 dB,1998
30,박상민 비원(悲願),비원(悲願),박상민,발라드,핼쑥한 모습이었었지 말하기 조차 힘이 들어 침묵의 그 시간이 흘러간 뒤에 마지막으로 내게 하던 말 나보다 못난 사람에게 잊혀져 있던 사람에게 나 전에 사랑했던 그 사람에게 돌아가야만 될 것 같다고 미안하단 말과 함께 흐느끼던 너의 모습 이제와서 무슨 상관이냐고 따지듯이 이내 절규했지만 나는 아무렇지 않아 너만 행복해준다면 허나 이 말 한마디만 너를 너무 사랑했어 미안하단 말과 함께 흐느끼던 너의 모습 이제와서 무슨 상관이냐고 따지듯이 이내 절규했지만 나는 아무렇지 않아 너만 행복해준다면 허나 이 말 한마디만 너를 너무 사랑했어 나는 아무렇지 않아 너만 행복해준다면 허나 이 말 한마디만 너를 너무 사랑했어 그 후론 그녀에겐 어떤 아무런 소식조차 없죠 하지만 행복할꺼라고 믿으며 이 노래 속에 그녈 보내요,"2,383",1998,Park Sang Min,비원,F Minor,4A,84.0,4:08,0.0,64.0,54.0,53.0,38.0,0.0,9.0,3.0,-6 dB,1998
31,김장훈 세상이 그대를 속일지라도,세상이 그대를 속일지라도,김장훈,발라드,흔들리는 그대를 보면 내 마음이 더 아픈거죠 그댈 떠나 버린 사람이 누군지 몰라도 이젠 다 잊어 주길 바래요 한없이 울고 싶어지면 울고 싶은 만큼 울어요 무슨 얘기를 한다해도 그대의 마음을 위로할 수 없는걸 알기에 난 어쩌면 그 사람과의 만남을 잘 되지 않기를 바랬는지도 몰라요 그대를 볼때면 늘 안타까웠던 거죠 우리의 만남이 조금 늦어다는 것이 이젠 모든걸 말할 수 있어요 그 누구보다 그댈 사랑했음을 세상이 그대를 속일지 몰라도 내가 그대 곁에 있음을 기억해요 난 어쩌면 그 사람과의 만남을 잘 되지 않기를 바랬는지도 몰라요 그대를 볼때면 늘 안타까웠던 거죠 우리의 만남이 조금 늦었다는 것이 이젠 모든걸 말할 수 있어요 그 누구보다 그댈 사랑했음을 세상이 그대를 속일지 몰라도 내가 그대 곁에 있음을 기억해요 이젠 모든걸 말할 수 있어요 그 누구보다 그댈 사랑했음을 세상이 그대를 속일지 몰라도 내가 그대 곁에 있음을 기억해요,"2,824",1998,Kim Jang-Hoon,세상이 그대를 속일지라도,C# Major,3B,137.0,4:41,30.0,49.0,26.0,17.0,61.0,0.0,8.0,3.0,-5 dB,1998
32,터보 회상 (December),회상 (December),터보,발라드,겨울 오면은 우리 둘이서 항상 왔었던 바닷가 시린 바람과 하얀 파도는 예전 그대로였지만 나의 곁에서 재잘거리던 너의 해맑던 그 모습 이젠 찾을 수 없게 되었어 아무도 없는 겨울의 바닷가 너무나 슬퍼 보인다고 우리가 바다 곁에서 친구가 되자고 내 등에 숨어 바람을 피할 때 네 작은 기도를 들었지 언제나 너의 곁에 우리 항상 함께 해달라고 거친 파도가 나에게 물었지 왜 혼자만 온거냐고 넌 어딜갔냐고 보이지 않니 나의 뒤에 숨어서 바람을 피해 잠을 자고 있잖아 따뜻한 햇살 내려오면 깰거야 조금만 기다려 다시는 너를 볼수 없을거라는 얘기를 차마 할순 없었어 하지만 나도 몰래 흘린 눈물 들킨거야 그녈 절대로 찾을 수 없다고 나를 스쳐갔던 바람이 말했나봐 어딜가도 그녀 모습 볼수가 없다고 내게 말했나봐 어디가냐고 말을 하라고 자꾸만 재촉하던 바닷가 결국엔 나처럼 눈물이 되고야 말았어 하얗게 내린 바다의 눈물로 니 모습 만들어 그 곁에서 누워 니 이름을 불러 봤어 혹시 너 볼까봐 녹아 버릴까 걱정이 됐나봐 햇살을 가린 구름 떠나지 않잖아 너 없는 바다 눈물로만 살겠지 거칠은 파도 나를 원망하면서 너없이 혼자 찾아오지 말라고 널 데려오라고 니 모습 볼 수 없다해도 난 알아 내 볼에 닿은 하얀 함박눈 촉촉한 너의 입맞춤과 눈물이라는 걸 그녈 절대로 찾을 수 없다고 나를 스쳐갔던 바람이 말했나봐 어딜가도 그녀 모습 볼수가 없다고 내게 말했나봐 어디가냐고 말을 하라고 자꾸만 재촉하던 바닷가 결국엔 나처럼 눈물이 되고야 말았어 니 모습 볼 수 없다해도 난 알아 내 볼에 닿은 하얀 함박눈 촉촉한 너의 입맞춤과 눈물이라는 걸,"9,494",1998,TURBO,December,G Major,9B,103.0,4:21,44.0,67.0,77.0,79.0,32.0,0.0,9.0,5.0,-6 dB,1998
