,artist_song,song_x,artist_x,genre,lyric,like,year_x,artist_y,song_y,key,camelot,bpm,duration,popularity,energy,danceability,happiness,acousticness,instrumentalness,liveness,speechiness,loudness,year_y
33,넥스트 해에게서 소년에게,해에게서 소년에게,신해철,록/메탈,눈을 감으면 태양의 저 편에서 들려오는 멜로디 내게 속삭이지 이제 그만 일어나 어른이 될 시간이야 너 자신을 시험해 봐 길을 떠나야 해 니가 흘린 눈물이 마법의 주문이 되어 너의 여린 마음을 자라나게 할 거야 남들이 뭐래도 네가 믿는 것들을 포기하려 하거나 움츠러 들지 마 힘이 들 땐 절대 뒤를 돌아보지 마 앞만 보며 날아가야 해 너의 꿈을 비웃는 자는 애써 상대하지 마 변명하려 입을 열지 마 그저 웃어 버리는 거야 아직 시간이 남아 있어 너의 날개는 펴질 거야 Now We are flying to the universe 마음이 이끄는 곳 높은 곳으로 날아가 절대 뒤를 돌아보지 마 앞만 보며 날아가야 해 너의 꿈을 비웃는 자는 애써 상대하지 마 변명하려 입을 열지 마 그저 웃어 버리는 거야 아직 시간이 남아 있어 너의 날개는 펴질 거야 더 높이 더 멀리 너의 별을 찾아 날아라 소년아 저 모든 별들은 너보다 먼저 떠난 사람들이 흘린 눈물이란다 세상을 알게 된 두려움에 흘린 저 눈물이 이 다음에 올 사람들을 인도하고 있는 것이지,"16,731",1998,N.EX.T,해에게서 소년에게,D Major,10B,98.0,5:07,26.0,73.0,53.0,18.0,0.0,0.0,37.0,3.0,-4 dB,1998
34,최재훈 외출,외출,최재훈,록/메탈,너무나도 모자란 날 알기에 기다리라곤 못했어 기다림에 많이 힘겨워하는 너를 난 볼 수 없을테니까 지금 나의 그냥 있는 그대로 넌 상관없다 하지만 난 제대로 너와 시작하고픈 널 맞이 하고픈 그 맘을 이해해 나도 너 만큼은 두려운 걸 허나 니가 지칠 만큼 오래 걸리지는 않도록 나 약속할테니까 잠시 날 잊어 힘들지 않게 너 슬퍼해도 흔들려도 안아 줄 수 없으니 돌아갈거야 나를 믿어줘 널 떠난이유 이해한다면 기다려 나도 너 만큼은 두려운 걸 허나 니가 지칠 만큼 오래 걸리지는 않도록 나 약속할테니까 잠시 날 잊어 힘들지 않게 너 슬퍼해도 흔들려도 안아 줄 수 없으니 돌아갈거야 나를 믿어줘 널 떠난이유 이해한다면 잠시 날 잊어 힘들지 않게 너 슬퍼해도 흔들려도 안아 줄 수 없으니 돌아갈거야 나를 믿어줘 널 떠난이유 이해한다면 기다려,"2,636",1998,Choi Jae Hoon,외출,A♭ Major,4B,142.0,4:31,5.0,51.0,46.0,18.0,2.0,0.0,19.0,3.0,-6 dB,1998
35,신성우 사랑한 후에,사랑한 후에,신성우,록/메탈,세상을 살아오는 동안에 몇 번의 사랑들을 만나게 되고 때론 결코 원치 않는 이별들도 해야 했었답니다 하지만 당신만은 내 곁에 영원히 두고 싶던 나의 마음은 그저 부질없는 욕심이었나요 아직 알 수 없어요 당신이 떠나가던 그 날에 그저 사랑하는 마음 하나만으로는 지킬 수 없다는 게 세상에 있다는 걸 비로소 깨닫게 되었죠 내가 사랑하는 그대여 내게 어두움이 머물면 환한 미솔 건네주던 당신이 나의 곁에 있었다는 사실만으로 이렇게 웃을 수 있는데 나를 떠나가는 그대여 아쉬운 기억들은 여기 두고 떠나요 당신의 마음 속에 행복만이 가득하기를 이젠 내가 기도 할게요 내가 사랑하는 그대여 내게 어두움이 머물면 환한 미솔 건네주던 당신이 나의 곁에 있었다는 사실만으로 이렇게 웃을 수 있는데 나를 떠나가는 그대여 아쉬운 기억들은 여기 두고 떠나요 당신의 마음속에 행복만이 가득하기를 이젠 내가 기도 할게요,961,1998,Shin Sung Woo,사랑한 후에,A Major,11B,144.0,4:27,19.0,46.0,45.0,27.0,12.0,0.0,10.0,3.0,-9 dB,1998
36,YB (윤도현 밴드) 먼 훗날,먼 훗날,YB (윤도현 밴드),록/메탈,널 이제 잊겠어 내 깊은 그리움으로 이 밤을 지새운건 아니었는데 이제는 닦아낼 눈물이 없어 하고픈 말 서럽게 쌓여만 가고 기억되는 그리움의 아픔이 너무 두려워 홀로 남겨진 이 순간 원할건 없지만 정말 널 사랑해 차마 그 말 한마디 못한 내가 너무나도 원망스러워 먼 훗날 다시 널 우연히 마주칠 수 있다면 사랑했다 말할꺼야 기억되는 그리움의 아픔이 너무 두려워 홀로 남겨진 이 순간 원할건 없지만 정말 널 사랑해 차마 그 말 한마디 못한 내가 너무나도 원망스러워 먼 훗날 다시 널 우연히 마주칠 수 있다면 사랑했다 말할꺼야 정말 널 사랑해 차마 그 말 한마디 못한 내가 너무나도 원망스러워 먼 훗날 다시 널 우연히 마주칠 수 있다면,"18,402",1998,YB,박하사탕,A Major,11B,180.0,4:50,39.0,61.0,44.0,43.0,5.0,0.0,11.0,4.0,-7 dB,1998
37,아낌없이 주는 나무 내게 너무 이쁜 그녀,내게 너무 이쁜 그녀,아낌없이 주는 나무,발라드,미안해 정말 조금만 기다려줘 널 위해 분주한 혜화역에서 장미꽃을 샀어 덕수궁 앞을 지날 때마다 신혼부부의 사진 찍는 걸 언제나 부러워하는 그녀를 위해 강릉차편에 올랐지 아무 계획도 없이 떠나는 그리운 여정 우리의 긴 오해만큼 흐린 창밖으로 이따금 비가 내려 추억으로 가는 차편엔 나를 아는 이가 없고 나도 아는 이 없는 막연히 그리운 길 찾아 가네 추억으로 가기 위해 타는 차편엔 더는 갈 곳 없는 사람들 살아가는 날만큼 사랑할거야 내게 너무 이쁜 그녀를 아무 계획도 없이 떠나는 그리운 여정 우리의 긴 오해만큼 흐린 창밖으로 이따금 비가 내려 추억으로 가는 차편엔 나를 아는 이가 없고 나도 아는 이 없는 막연히 그리운 길 찾아 가네 추억으로 가기 위해 타는 차편엔 더는 갈 곳 없는 사람들 살아가는 날만큼 사랑할거야 내게 너무 이쁜 그녀를 살아가는 날만큼 사랑할거야 내게 너무 이쁜 그녀를,104,1998,Key,Camelot,BPM,,,Popularity,,,,,,,,,,1998
38,김현정 혼자한 사랑,혼자한 사랑,김현정,댄스,너의 모습을 처음 봤을때 사랑이라고 느끼고 싶었지 하지만 너는 내게 별 관심을 보이지 않아 난 화가 났었지 지금까지 이런 기분은 처음인것만 같아 어느 곳 어느 자리에 시선을 모아도 보이는건 너의 모습뿐 다른건 관심 없어 하지만 나의 마음을 네게 보이긴 정말 싫어 너와 함께 할수 있다면 그 어떤 슬픔조차 나는 감당할수 있을것 같은데 사랑한다는 말을 하기엔 넌 내게 너무나도 멀리 있는것 같아 그 어떤 사랑도 난 원치 않았지 이별을 견뎌낼 자신이 없기에 하지만 이렇게 니가 내 마음을 장악할지는 예상도 못했지 지금까지 이런 기분은 처음인것만 같아 어느 곳 어느 자리에 시선을 모아도 보이는건 너의 모습뿐 다른건 관심 없어 하지만 나의 마음을 네게 보이긴 정말 싫어 너와 함께 할수 있다면 그 어떤 슬픔조차 나는 감당할수 있을것 같은데 사랑한다는 말을 하기엔 넌 내게 너무나도 멀리 있는것 같아 너와 함께 할수 있다면 그 어떤 슬픔조차 나는 감당할수 있을것 같은데 사랑한다는 말을 하기엔 넌 내게 너무나도 멀리 있는것 같아,"3,838",1998,Giving Tree,내게 너무 이쁜 그녀,B Minor,10A,108.0,4:53,1.0,70.0,71.0,59.0,51.0,0.0,10.0,3.0,-5 dB,1998
39,김동률 배려,배려,김동률,발라드,가끔 너는 내게 아무렇지도 않은 듯이 나의 안부를 묻곤 하지 태연히 나는 아직 너의 너무도 좋은 친구라며 어색한 내 모습을 되려 탓하지 떠난 사람은 그리 편한건지 모른 척 하는지 언제까지 기다린단 내 말 잊은건지 진정 나를 위한다면 이쯤에서 그만 날 놓아줘 사랑했던 마음이라도 간직할 수 있게 이런 내가 가엾다면 두 번 다시 날 찾지 말아줘 니가 없는 채로 세상에 길들여 질 수 있게 떠난 사람은 그리 편한건지 모른 척 하는지 언제까지 기다린단 내 말 잊은건지 진정 나를 위한다면 이쯤에서 그만 날 놓아줘 사랑했던 마음이라도 간직할 수 있게 이런 내가 가엾다면 두 번 다시 날 찾지 말아줘 돌아올 수 없는 거라면 차라리 멀리 떠나줘 제발,"78,984",1998,Kim Dong Ryul,Consideration (Studio Ver.),F Minor,4A,119.0,4:10,9.0,33.0,41.0,24.0,87.0,0.0,45.0,4.0,-9 dB,1998
40,양파 알고 싶어요!,알고 싶어요!,양파,발라드,내가 그대에게 부족한걸 알아요 아일 보는듯한 그런 눈빛 그건 너무나 슬픈걸요 아직 내가 어리다고 세상 모두가 말한대도 다 상관없지만 그대에겐 난 사랑이고 싶어요 그대 이토록 아름다운 다른 세상을 펼쳐주며 내가 더 가까이 보게 빛을 밝혔죠 난 너무나 조심스레 늘 고개만 숙이지만 이런 내 마음을 볼수 있나요 조금 기다려요 아주 조금만 기다려줘요 그대가 원하는 그런 모습 내가 돼드릴 그때까지 사랑하는 걸요 그대 모든걸 알고 싶어요 이룰수 있겠죠 나의 첫사랑을요 지난 꿈속에 내 모습처럼 나 행복하게요 그대 이토록 아름다운 다른 세상을 펼쳐주며 내가 더 가까이 보게 빛을 밝혔죠 난 너무나 조심스레 늘 고개만 숙이지만 이런 내 마음을 볼수 있나요 조금 기다려요 아주 조금만 기다려줘요 그대가 원하는 그런 모습 내가 돼드릴 그때까지 사랑하는 걸요 그대 모든걸 알고 싶어요 이룰수 있겠죠 나의 첫사랑을요 지난 꿈속에 내 모습처럼 나 행복하게요,"9,231",1998,Yangpa,알고 싶어요!,A Major,11B,178.0,4:12,16.0,59.0,39.0,23.0,33.0,0.0,11.0,3.0,-7 dB,1998
41,A.R.T 슬픈 얼굴,슬픈 얼굴,A.R.T,발라드,마지막 부탁이야 힘들지 않도록 슬픈얼굴 짓지 말아줘 어둠이 나를 덮어 깊은잠에 들면 편히쉴수 있도록 여자들이란 현재에 충실할 뿐 내가 떠나가면 넌 곧 나를 잊겠지 그 긴밤 지새우며 내게했던 맹세는 모두 거짓이 되겠지 그러니 됐어 아무말도 하지마 알아 그 눈물의 의미를 넌 나를 위로하려 하지 않아도 돼 그냥 나를 두고 그만 떠나가 꿈이었길 바래 내 앞에 다가선 니 현실들 가끔씩 눈물이 나 널 두고 가야하는 생각에 내 손을 잡아줘 마지막 너를 느끼고 싶어 어제의 내 모습은 언제나 너의 곁에 있을꺼야 바람에 흩어지는 회색먼지처럼 그렇게 난 잊혀져 가겠지 기억해줘 내게 머물다간 어떤 사람이 있다는걸 마지막 부탁이야 힘들지 않도록 슬픈얼굴 보이지 말아줘 어둠이 나를 덮어 깊은 잠에 들면 내가 편히 쉴 수 있도록 다시는 돌아올 수 없는 그 먼 곳으로 여행을 떠나는 거라고 생각해 너 혼자 남겨두고 떠나야만 하는 내 마음은 더 아파 하지만 어쩌겠니 정해진 시간은 이미 끝났는 걸 아무리 잡으려해도 잡히지 않는 떠나간 내 시간들 좋은 기억들은 슬픈 추억으로 묻고 이제는 떠나가 미련없이 너는 너의 갈길을가 이제는 너는 내 모든 것을 흙으로 재로 날려 보내줘 내 사진도 내 향기도 내 눈물에 가려 희미해져 가는 모든 것들 웃으며 갈 수 있게 조금만 나에게도 시간을 줘 바람에 흩어지는 회색먼지처럼 그렇게 난 잊혀져 가겠지 기억해줘 내게 머물다간 어떤 사람이 있다는걸 마지막 부탁이야 힘들지 않도록 슬픈얼굴 보이지 말아줘 어둠이 나를 덮어 깊은 잠에 들면 내가 편히 쉴 수 있도록 바람에 흩어지는 회색먼지처럼,328,1998,Key,Camelot,BPM,,,Popularity,,,,,,,,,,1998
42,김종서 Love Song,Love Song,김종서,록/메탈,가끔은 생각 날까 지금 나처럼 내일도 그길에 미소지으며 나를 기다리고 있을것 같아 다시 볼수 없대도 행복할 수 있는 나 똑같은 세상에 살고 있다는 그 한가지 이유만으로 지난 여름날 내게 줬던 커플링 하얗게 빈 자국만이 나의 마음을 아프게 해 난 아직도 널 사랑해 세상 끝나는 날 그 순간까지 나의 마음 깊은 곳에 넌 살아 있으니 난 괜찮아 너 떠나도 잠시 너를 맡긴거라 생각해 혹시라도 힘겨울 때 다시 돌아와 니가 있던 그 자리 지난 여름날 내게 줬던 커플링 하얗게 빈 자국만이 나의 마음을 아프게 해 난 아직도 널 사랑해 세상 끝나는 날 그 순간까지 나의 마음 깊은 곳에 넌 살아 있으니 난 괜찮아 너 떠나도 잠시 너를 맡긴거라 생각해 혹시라도 힘겨울 때 다시 돌아와 니가 있던 그 자리,"2,070",1998,Piano Diary,Your face is sad,C Minor,5A,76.0,2:24,0.0,12.0,53.0,26.0,99.0,89.0,12.0,9.0,-20 dB,1998
43,김조한 널 위해 준비된 사랑,널 위해 준비된 사랑,김조한,R&B/Soul,오늘을 꿈꿔왔지 우리 하나가 되는 날을 벅찬 기쁨 속에 난 너의 손을 잡고 있어 수줍게 고개숙인 미소로 나를 바라보는 새하얀 네 모습 너무나도 아름다워 기다렸던 나를 위해 이 땅에 보내어진 또 다른 나일 그대를 처음 본 그 순간 내 영혼의 깊은 샘 속에서 사랑을 만난거야 알 수 있었지 나만의 사랑인걸 아낄게 너만을 이 세상 그 누구보다 아름답고 행복하게 지킬게 사랑해 영원히 이 세상 단 하나뿐인 널 내 전부라 말하고 싶어 기다렸던 나를 위해 이 땅에 보내어진 또 다른 나일 그대를 처음 본 그 순간 내 영혼의 깊은 샘 속에서 사랑을 만난거야 알 수 있었지 나만의 사랑인걸 아낄게 너만을 이 세상 그 누구보다 아름답고 행복하게 지킬게 사랑해 영원히 이 세상 단 하나뿐인 널 내 전부라 말하고 싶어 나 또한 널 위해 보내어진 널 위해 준비된 사랑 아낄게 너만을 이 세상 그 누구보다 아름답고 행복하게 지킬게 사랑해 사랑해 영원히 영원히 이 세상 단 하나뿐인 널 내 전부라 말하고 싶어 널 위해 준비된 사랑,"3,443",1998,코케,Love Song : Originally Performed By 김종서 Karaoke Verison,A♭ Major,4B,74.0,4:28,0.0,17.0,47.0,9.0,21.0,87.0,14.0,3.0,-17 dB,1998
44,리아 눈물,눈물,리아,록/메탈,이럴줄은 몰랐어 사랑을 느꼈어 떠난다는 그말에 나 울어 버린거야 내겐 그런 슬픈일이 없을 줄 알았었는데 우리 처음 만난 날 기억하고 있어 널 닮아 버린 모습도 그 무슨 소용있니 이제 너를 본다는 건 욕심이 돼버린 거야 울었어 눈물을 참지 못해 울었어 부은 눈을 감고 잠이 들었어 미칠 것만 같았어 하늘도 울고만있어 이런게 이별인 줄 몰랐던 거야 혼자 남아 버렸어 믿을 수 없었어 세상이 날 버리고 모두 날 버린거야 나는 지쳐만 가는데 이젠 어떻게 살라고 울었어 눈물을 참지 못해 울었어 부은 눈을 감고 잠이 들었어 미칠 것만 같았어 하늘도 울고만있어 이런게 이별인줄 몰랐던 거야 울었어 눈물을 참지 못해 울었어 부은 눈을 감고 잠이 들었어 미칠 것만 같았어 하늘도 울고만있어 이런게 이별인줄 몰랐던 거야,704,1998,RIAA,눈물,C Minor,5A,124.0,4:19,17.0,71.0,60.0,34.0,26.0,0.0,8.0,3.0,-6 dB,1998
45,뱅크 그녀의 생일,그녀의 생일,뱅크,발라드,너에게 전화하고 싶었어 오늘만은 달력위에 네가 적었던 너의 생일날 행복했던 작년 오늘 일을 기억하니 너 없는 지금도 그리워 그 때 그 날이 혹시라도 널 만날까 너의 집주위를 서성거리며 네가 오길 기다리는 그런 내 마음을 너는 이해할 수 있니 불꺼진 너의 창을 바라보면서 할 수만 있다면 다시 한번 더 너를 내 품안에 안고 얘기하고 싶어 비어있는 내 자리가 힘겹지 않니 오늘 네 생일에 내가 준비한 나의 선물을 받아주렴 바로 나야 행복했던 작년 오늘 일을 기억하니 너 없는 지금도 그리워 그 때 그 날이 혹시라도 널 만날까 너의 집주위를 서성거리며 네가 오길 기다리는 그런 내마음을 너는 이해할 수 있니 불꺼진 너의 창을 바라보면서 할 수만 있다면 다시 한번 더 너를 내 품안에 안고 얘기하고 싶어 비어있는 내 자리가 힘겹지 않니 오늘 네 생일에 내가 준비한 나의 선물을 받아주렴 바로 나야,"1,734",1998,Bank,Her Birthday - Radio Edit,E Major,12B,74.0,4:15,0.0,46.0,47.0,27.0,64.0,0.0,12.0,3.0,-8 dB,1998
46,박진영 Honey,Honey,박진영,댄스,그대를 처음 본 순간 난 움직일 수가 없었지 그대 그 아름다운 모습 난 넋을 잃고야 말았지 그대의 아름다운 그 미소가 나를 사로 잡았지 hey 거기 그래 자기 웬만하면 내게 오지 우리 여기에서 둘이 멋진 밤을 함께 하지 oh honey 오 베이비 어쩜 아름답기도 하지 내게 오지 나를 믿지 절대 후회할리 없지 그대의 그 섹시한 눈빛 오 나를 또 바라보았지 눈빛이 마주치는 순간 난 숨을 쉴수가 없었지 그대야말로 하늘이 내려주신 진정한 honey지 hey 거기 그래 자기 웬만하면 내게 오지 우리 여기에서 둘이 멋진 밤을 함께 하지 oh honey 오 베이비 어쩜 아름답기도 하지 내게 오지 나를 믿지 절대 후회할리 없지 Now Everybody Party 내게로 걸어오는 그대 난 바라볼 수가 없었지 걸어오는 그대의 모습 너무 눈부시기 때문이지 이제서야 비로소 나 나 새로운 사랑에 눈을 뜬거지 hey 거기 그래 자기 웬만하면 내게 오지 우리 여기에서 둘이 멋진 밤을 함께 하지 oh honey 오 베이비 어쩜 아름답기도 하지 내게 오지 나를 믿지 절대 후회할리 없지 hey 거기 그래 자기 웬만하면 내게 오지 우리 여기에서 둘이 멋진 밤을 함께 하지 oh honey 오 베이비 어쩜 아름답기도 하지 내게 오지 나를 믿지 절대 후회할리 없지,"14,070",1998,Johan Kim,Honey (박진영),C Major,8B,116.0,4:07,11.0,91.0,41.0,59.0,33.0,0.0,64.0,15.0,-4 dB,1998
47,조관우 길,길,조관우,발라드,지금 그대는 어디쯤 오는지 아직 와야할길이 더 많은지 잠시 다녀오겠다던 발걸음 오시는길에 헤메이다 나를 비켜갔는지  서글픈 사랑 안녕 지친세월 안고 홀로 견딘 나의 기다림 모두 부질 없으니 그대 더딘 발걸음 서둘러 오지마 이젠 누구의 가슴에라도 그대 편히 쉬어야 할테니  차마 버릴수 없는건 그리움  아득했던 슬픔 모두 쓰러져 한때 사랑했던 기억만으로 놓을수 없는 목숨 하나 이어가야 하는데  서글픈 사랑 안녕 지친세월 안고 홀로 견딘 나의 기다림 모두 부질 없으니 그대 더딘 발걸음 서둘러 오지마 이젠 누구의 가슴에라도 그대 편히 쉬어야 할테니 -,"1,475",1998,Jo Kwan Woo,길,B Minor,10A,159.0,4:28,14.0,36.0,48.0,38.0,61.0,0.0,9.0,3.0,-11 dB,1998
48,김현철 거짓말도 보여요,그대 내게 행복을 주는 사람,김현철,발라드,내가 가는 길이 험하고 멀지라도 그대 함께 간다면 좋겠네 우리 가는 길에 아침햇살 비추면 행복하다고 말해 주겠네  이리저리 둘러봐도 제일 좋은건 그대와 함께 있는것 -  그대 내게 행복을 주는 사람 내가 가는 길이 험하고 멀지라도 그대 내게 행복을 주는 사람  때론 지루하고 외로운 길이라도 그대 함께 간다면 좋겠네 때론 즐거움에 웃음짓는 나날이어서 행복하다고 말해주겠네  이리저리 둘러봐도 제일 좋은건 그대와 함께 있는것 -  그대 내게 행복을 주는 사람 내가 가는 길이 험하고 멀지라도 그대 내게 행복을 주는 사람  이리저리 둘러봐도 제일 좋은 건 그대와 함께 있는 것 -  그대 내게 행복을 주는 사람 내가 가는 길이 험하고 멀지라도 그대 내게 행복을 그대 내게 행복을 주는 사람  그대 내게 행복을 주는 사람 -,"5,700",1998,Kim Hyun Chul,거짓말도 보여요,F# Minor,11A,136.0,5:06,8.0,33.0,66.0,55.0,60.0,1.0,27.0,3.0,-12 dB,1998
49,김현성 소원,소원,김현성,발라드,알고 있죠 이것이 끝이라는걸 두번 다시 볼순 없겠죠 이젠 나아닌 다른 사람과 또 다른 추억들을 만들어 가겠죠  괜찮아요 그대 떠나신대도 추억들은 내맘에 있으니 그저 사랑했었던 기억은 그냥 두고 떠나가세요  언제부턴가 그대없는 날 보죠 그럴때면 나도 모르게 자꾸 눈물이 나요 내가 왜 싫어졌는지 가르쳐 줄순 없나요 아직도 그대 사진은 날 보며 웃고 있는데  우린 여기까진가요 죽어도 난 아닌가요 이해해보고 싶지만 그게 잘 안되나봐요 이제는 끝인걸 알지만 생각의 마지막엔 이러지 말았으면 해요  그쵸 내가 뭔가 잘못한거죠 원하시면 고쳐볼께요 어렵지 않은걸요 내가 왜 싫어졌는지 가르쳐 줄순 없나요 아직도 그대 사진은 날 보며 웃고 있는데  우린 여기까진가요 죽어도 난 아닌가요 이해해보고 싶지만 그게 잘 안되나봐요  다신 울지 않을께요 눈물이 흐를때마다 함께한 지난 추억이 초라해 질테니까요 이제는 끝인걸 알지만 생각에 마지막엔 이러지 말았으면 해요 -,"2,243",1998,Kim Hyun Sung,소원,F Minor,4A,138.0,4:27,18.0,37.0,42.0,18.0,51.0,0.0,13.0,3.0,-9 dB,1998
50,임창정 별이 되어,별이 되어,임창정,발라드,어디에선가 날 보고 있을까 냉정하게 떠나간 너는 변명도 너는 하지 않았어 그런 너를 난 미워 했는데 믿을 수 없는 편지를 받았어 젖어있는 하얀 종이에 난 이미 세상에 없을 거라고 나를 위해 꼭 행복하라고 단 한번 널 사랑했던 내가 걱정돼서 아파하며 너 떠나갔니 용서해 널 몰랐던 날 다신 너를 혼자 보내진 않을께 하늘의 별이 되어 기다려줘 눈을 감을 때 날 생각했었니 널 미워하고 있던 나를 너 없는 아침을 볼 때마다 살아있는 난 아파하겠지 하루가 지나고나면 널 만날 하루가 더 가까워 오는 거겠지 용서해 널 몰랐던 날 다신 너를 혼자 보내진 않을께 하늘의 별이 되어 기다려줘 하루가 지나고나면 널 만날 하루가 더 가까와 오는 거겠지 용서해 널 몰랐던 날 다신 너를 혼자 보내진 않을께 하늘의 별이 되어 기다려줘,"80,338",1998,Key,Camelot,BPM,,,Popularity,,,,,,,,,,1998
51,유리상자 처음 주신 사랑,처음 주신 사랑,유리상자,발라드,항상 그래 왔지 확신도 없는 고백들에 후회하곤 했지 단지 편한 사람을 사랑이라며 자신도 없는 약속했지만 하지만 그녀에게만은 아껴주고 싶어요 확인하고 싶은 그앤 재촉하죠 하지만 그녀에게만은 서두르지 않아요 당신안에서 우린 이미 하나가 된 걸요 지켜주세요 처음 주신 그대로의 사랑을 우리 함께하는 이 시간들이 언제까지나 사랑으로 남도록 비록 아무 가진 것 없을지라도 믿음 안에서 행복할꺼죠 하지만 그녀에게만은 아껴주고 싶어요 확인하고 싶은 그앤 재촉하죠 하지만 그녀에게만은 서두르지 않아요 당신안에서 우린 이미 하나가 된걸요 켜주세요 처음 주신 그대로의 사랑을 그녈 내게 주시려 때론 아픈 눈물도 주셨나요 이젠 그럴 필요 없겠죠 영원히 하지만 그녀에게만은 아껴주고 싶어요 확인하고 싶은 그앤 재촉하죠 하지만 그녀에게만은 서두르지 않아요 당신 안에서 우린 이미 하나가 된걸요 지켜주세요 처음 주신 그대로의 사랑을,"2,054",1998,Lim Changjung,별이 되어,E♭ Major,5B,72.0,4:10,11.0,34.0,49.0,14.0,17.0,0.0,7.0,3.0,-9 dB,1998
