,artist_song,song_x,artist_x,genre,lyric,like,year_x,artist_y,song_y,key,camelot,bpm,duration,popularity,energy,danceability,happiness,acousticness,instrumentalness,liveness,speechiness,loudness,year_y
0,엄정화 Poison,Poison,엄정화,댄스,널 뒤로한채 그냥 걸었어 미안해 하는 널 위해 참아온 눈물 보이기 싫어 나 먼저 일어선거야 오늘이 올 줄 알고 있었어 우리 사랑 끝나는 날 잘못된 우릴 하늘이 분명 용서할리 없으니까 그녀에게 미안하다고 전해줘 그녀의 행복을 내가 가졌으니 다신 이런 아픔을 남기지는마 나 하나로만 된거야 모두를 속여가며 사랑한 넌 더 힘들었니 이젠 꿈에서라도 나를 찾지마 난 니안에 없는거야 이대로 나를 잊고 돌아가 그녀품으로 내품에 안겨 울던 모습도 날 위한 연극이었니 너의 사랑은 나뿐이라고 그 말을 믿었었는데 사랑스런 미소와 따스한 눈길 이제는 그녀와 함께 나누겠지 다신 이런 아픔을 남기지는마 나 하나로만 된거야 모두를 속여가며 사랑한 넌 더 힘들었니 이젠 꿈에서라도 나를 찾지마 난 니안에 없는거야 이대로 나를 잊고 돌아가 그녀품으로 그래 누구나 한 사람만을 사랑해야 하는걸 이제 넌 그걸 잊지 말아줘,"7,718",1998,Uhm Jung Hwa,Poison,B Minor,10A,135.0,3:44,38.0,94.0,67.0,72.0,0.0,1.0,5.0,5.0,-6 dB,1998
1,김현정 그녀와의 이별,그녀와의 이별,김현정,댄스,이제 우리 정말 끝난거야 니가 다시 확인시켜줬지 그럴 필요까진 없었는데 마지막 자존심까지 무너졌어 나를 만나기전 헤어졌던 예전의 그녀에게서 너를 떠나달란 말을 듣게 했어 미안하단 말과 함께 믿지 않았어 그녀의 일방적인 얘기들 나를 속이며 그동안 만나왔단 얘기도 너를 사랑한 그녀의 거짓말이었기를 비참하게 난 끝까지 어리석게 널 믿어 버렸어 하지만 나의 마지막 기대마저도 모두 무너진 거야 술취해 또 다시 너를 찾아가 그녈 안아주는 너를 보았어 지금 내눈에 흐른 눈물은 너도 모른척 해줘 남겨진 미련도 없지만 모두 니가 가져 버려 며칠이 지났어 널 잊은줄 알았어 그런데 지금 니가 돌아오길 바라는 내가 미울뿐야 믿지 않았어 그녀의 일방적인 얘기들 나를 속이며 그동안 만나왔단 얘기도 너를 사랑한 그녀의 거짓말이었기를 비참하게 난 끝까지 어리석게 널 믿어 버렸어 하지만 나의 마지막 기대마저도 모두 무너진 거야 술취해 또 다시 너를 찾아가 그녈 안아주는 너를 보았어 지금 내눈에 흐른 눈물은 너도 모른척 해줘 남겨진 미련도 없지만 모두 니가 가져 버려 며칠이 지났어 널 잊은줄 알았어 그런데 지금 니가 돌아오길 바라는 내가 미울뿐야,"3,838",1998,Kim Hyun Jung,Break up With Her,C Minor,5A,141.0,4:05,34.0,94.0,69.0,38.0,6.0,0.0,12.0,9.0,-2 dB,1998
2,쿨 (COOL) 애상,애상,쿨 (COOL),댄스,알잖아 너를 이토록 사랑하며 기다린 나를 뭐가 그리 바쁜지 너무 보기 힘들어 넌 도대체 뭐하고 다니니 그게 아냐 이유는 묻지마 그냥 믿고 기다려 주겠니 내게도 사랑을 위한 시간이 필요해 널 받아들일 수 있게 일부러 피하는거니 삐삐쳐도 아무 소식없는 너 싫으면 그냥 싫다고 솔직하게 말해봐 말리지마 내 이런 사랑을 너만 보면 미칠것 같은 이 맘을 누가 알겠어 웨딩드레스 입은 네 곁에 다른 사람이 난 두려워 나보다 더 멋진 그런 남자 네가 만날까봐 아니야 그렇지 않아 정말 너 하나뿐야 속는셈 치고 한번 믿어봐 내 눈에는 너무 이쁜 그녀를 자랑스레 친구에게 보여줬지 친구 내게 미안하다며 그녀 얘길 싸그리 다했지 그녈 만난 많은 남자중에 내 친구만도 여러명이야 말도 안돼 믿을 수 없어 혹시 쌍둥이 우연히 너를 보았지 다른 남자 품안에 너를 한번도 볼수 없었던 너무 행복한 미소 내 사랑은 무너져 버렸어 그게 아냐 변명이 아니라 그 남자는 나완 상관없어 잠시 나 어지러워서 기댄것 뿐이야 날 오해하진 말아줘 나 역시 많은 여자들 만났다가 헤어져도 봤지만 한꺼번에 많은 여자를 만난적은 없었어 네가 뭔데 날 아프게 하니 너 때문에 상처 돼버린 내 사랑 이제 다시는 너의 어떤 만남도 나 같은 사람 없을 걸 난 두려워 나 역시 다시는 이런 사랑 할 수 없을까봐 사랑까지는 바라지도 않을게 네 곁에 항상 있게만 해줘,"15,901",1998,COOL,애상,G Major,9B,124.0,3:33,46.0,92.0,73.0,91.0,4.0,0.0,13.0,4.0,-5 dB,1998
3,신승훈 지킬 수 없는 약속,지킬 수 없는 약속,신승훈,발라드,용서해 주겠니 너와의 약속 지킬수가 없어 니 모든걸 사랑하겠다는 지난날의 약속 니가 사랑하는 그 사람까진 사랑할순 없어 내가 먼저 이별을 말하고 너를 떠난다 생각나니 지난 우리의 사랑 지워버리기엔 너무 아름다웠잖아 너무 쉽게 날 잊어버리지는마 또 다른사랑에 행복하겠지만 한때는 너의전부였던 날 위해 사랑해 그래 떠나가라 너 없는 동안 내 모습 어떻게 되든지 상관없이 넌 살아 가겠지만 언젠가 돌아올 것 같은 널 위해 다른 사랑도 못하는 바보가 되버린 내 모습 잊지 않기를 바래 생각나니 지난 우리의 사랑 지워버리기엔 너무 아름다웠잖아 너무 쉽게 날 잊어버리지는마 또 다른사랑에 행복하겠지만 한때는 너의전부였던 날 위해 사랑해 그래 떠나가라 너 없는 동안 내 모습 어떻게 되든지 상관없이 넌 살아 가겠지만 언젠가 돌아올 것 같은 널 위해 다른 사랑도 못하는 바보가 되버린 내 모습 잊지 않기를 바래,"11,281",1998,Key,Camelot,BPM,,,Popularity,,,,,,,,,,1998
4,터보 애인이 생겼어요,애인이 생겼어요,터보,댄스,Yeah My Found My True Love This Is The Story 왜 너만 보면 가슴이 콩닥콩닥 거릴까 왜 너만 보면 입술이 바싹바싹 마를까 왜 너만 보면 다리가 비틀비틀 거릴까 나 아무래도 너에게 빠졌나봐 니 곁에만 있으면 가슴이 마구 떨려 오는 걸 아무리 태연한 척 하려해 봐도 안절 부절인 걸 나를 아는 친구들 이상한 눈초리로 나를 봐 한번도 여자 앞에 이런 내모습 본적 없으니까 어쩌다 너와 눈빛이라도 마주칠때면 난 쑥스러워 피해 버렸고 네 향기로운 머리결 스칠때면 어쩔줄 몰랐지 이렇게 달라질 수 있을까 완전히 다른 사람처럼 하지만 나도 몰라 이런 내 모습 너무 행복한걸 이제야 나의 짝을 만나게 됐어 나 그동안 만났던 사람 진정한 사랑이 아닌듯 이제야 만나게 됐어 나의 진정한 사랑을 그 누가 무슨말을 내게 한다 해도 이제 넌 나의 짝이됐고 이런 우릴 인정하지 않는 다면 의절이야 너무 보고 싶어서 너 없는 아침이 난 싫었지 하지만 요즘엔 괜찮아 꿈에도 너를 만나니까 가끔 너를 못 봐도 이 만큼 참아 낼 수 있는건 이제는 눈 감아도 항상 니모습 볼 수 있으니까 처음엔 나보다는 너를 더 걱정했었지 또 금방 너를 떠날지몰라 그런데 날이 가면 갈수록 왜 그런지 내가 더 심각해 이렇게 달라질 수 있을까 완전히 다른 사람처럼 하지만 나도 몰라 이런 내 모습 너무 행복한걸 이렇게 달라져도 괜찮아 그 누가 어떤말을 해도 언제나 너만 생각하고 너만을 바라보고 싶어 내가 네 마지막이 될것 같아 널 생각하면 입가엔 히죽히죽 미소가 널 생각하면 온몸엔 삐질삐질 땀이나 널 생각하면 세상이 모두 내 것만 같아 널 생각하지 않을께 너를 보고 있을래,"9,494",1998,Shin Seung Hun,Breakable Promise (2024 Remaster),A Minor,8A,177.0,4:36,1.0,39.0,52.0,10.0,38.0,0.0,12.0,3.0,-8 dB,1998
5,S.E.S. Dreams Come True,Dreams Come True,S.E.S.,댄스,내가 원하는 대로 자신 있는 모습 그대로 이제껏 숨겨 왔던 비밀을 네게 모두 말하고 싶어 baby Funny how all dreams come true 나를 지켜줄거야 아껴왔던 작은 사랑도 Funny how I feel for you 너의 곁에 그려질 꿈결같은 나의 미래도 처음 느낌 그대로 짜릿했던 느낌 그대로 서로가 약속했던 것처럼 같은 생각 갖고 있었지 baby Funny how all dreams come true 나를 지켜줄꺼야 아껴왔던 작은 사랑도 Funny how I feel for you 너 하나만 사랑해 Come on lover 언제나 둘이 함께 네가 있는 나 행복할 거에요 더 이상 슬픈 노래는 듣지 않을 거예요 내 맘을 알겠죠 Dreams come true 나를 지켜줄거야 아껴왔던 작은 사랑도 Funny how I feel for you 너의 곁에 그려질 꿈결같은 나의 미래도,"11,928",1998,aespa,Dreams Come True,C Major,8B,99.0,3:25,60.0,90.0,69.0,57.0,7.0,0.0,31.0,6.0,0 dB,1998
6,김건모 뻐꾸기 둥지위로 날아간 새,뻐꾸기 둥지위로 날아간 새,김건모,댄스,도대체 왜 이럴까 누가 좀 말려줘봐 왜 자꾸 어두워만지면은 밖으로 나가는지 모르겠어 오늘은 또 어디서 누구를 또 만날까 분명히 어제처럼 별 볼일 없이 끝날테지만 오늘밤이 이 세상에서 마지막이 될 것처럼 혼신의 힘을 다해서 춤추고 노래해 한마리 새처럼 내가 혼자라는 외로움이 그 안에 다시 못 들어오게 비라도 내리게 하늘을 찔러봐 저기 맑은 하늘 모두 다가 너의 세상이니까 도대체 몇명인지 셀수도 없을만큼 오늘밤 그대 곁에 왔다가 스쳐간 여자들은 많겠지만 어떻게 오셨나요 누구랑 오셨나요 똑같은 얘기들을 하고 있는 넌 뻐꾸기 같아 오늘밤에 누구라도 자기 짝을 찾기위해 혼신의 힘을 다해서 춤추고 노래해 한마리 새처럼 그냥 잠시라도 내 안에서 함께 할 사랑 찾고 싶어서 시간이 갈수록 불안해 지지만 그렇다고 다시 어제처럼 혼자이긴 싫었어 깨어진 어둠에 아침이 오나봐 주윌 둘러보고 알게됐어 오늘도 역시 혼자라는 걸 다시 또 혼자야 오늘도 혼자야 저기 너무 맑은 하늘 위로 새가 되어 버린 너,"15,158",1998,Kim Gun Mo,One Flew over the Cuckoo's Nest,F# Minor,11A,148.0,3:24,31.0,93.0,69.0,96.0,0.0,0.0,10.0,6.0,-6 dB,1998
7,유승준 나나나,나나나,유승준,댄스,난 그냥 되는 대로 살았었지 간섭받기 싫어 그냥 피했던거지 내일의 두려움도 필요 없어 그런 막막함에 내 시간만 좀먹었었어 그러다 내 어릴 적 꿈을 보았었지 거친 바람속 내 어릴 적 노랠 들었지 그래 이건 아니었어 용서할 수 없어 다시 나를 살린 이 노래를 불렀었지 기억하고 있니 어릴 적 예쁜 꿈들을 모두 다 이룰 수 있을 것 같던 시간들 소망을 꿈꾸며 주문을 외웠지 시간이 지나고 세상에 지쳐 갈 때쯤 꿈은 그저 꿈일 뿐인걸 알게 됐지만 어릴 적 주문을 아직 노래하네 언제나 힘들고 지칠때 날 일으켜주던 꿈이 가득한 이 노랠했어 나나나 나나나 나나나 나나나 나나나 나나나 나나나 나나나 어두워진 가리워진 나의 길을 밝혀주는 이 노래를 함께 해봐 어느 샌가 내게 찾아온 사랑을 위해 그렇게도 나를 애태운 그대를 위해 영원을 꿈꾸며 주문을 외웠지 피해갈수 없는 현실에 지쳐갈때쯤 무거워져 가는 걸음에 힘겨울때면 어릴적 주문을 노래 하곤 했지 언제나 힘들고 지칠때 날 일으켜주던 꿈이 가득한 이 노랠했어 나나나 나나나 나나나 나나나 나나나 나나나 나나나 나나나 어두워진 가리워진 나의 길을 밝혀주는 이 노래를 함께 해봐 자꾸만 어긋나 버리고 퇴색해 버리는 내 꿈을 지키고 싶었어 이기고 싶었어 누구도 가식의 가면을 버리지 않으려 끝끝내 발버둥 칠 때에 또 감추려 할때에 하늘에 새긴 내 어린 꿈들이 내 귓가에 들려준 이 노래 내 순수의 노래 키작은 아이의 함성과 내 사랑이 내게 들려준 이 노래 지켜갈 이 노래 언제나 힘들고 지칠때 날 일으켜주던 꿈이 가득한 이 노랠했어 나나나 나나나 나나나 나나나 나나나 나나나 나나나 나나나 초라하게 변해버린 나의 꿈을 밝혀주는 이 노래를 함께해봐 나나나 나나나 나나나 나나나 나나나 나나나 나나나 나나나 나나나 나나나 나나나 나나나 나나나 나나나 나나나 나나나,"2,591",1998,Steve Yoo,Na Na Na,C# Minor,12A,105.0,3:53,36.0,89.0,76.0,84.0,11.0,0.0,69.0,7.0,-4 dB,1998
8,유승준 나나나,나나나,유승준,댄스,난 그냥 되는 대로 살았었지 간섭받기 싫어 그냥 피했던거지 내일의 두려움도 필요 없어 그런 막막함에 내 시간만 좀먹었었어 그러다 내 어릴 적 꿈을 보았었지 거친 바람속 내 어릴 적 노랠 들었지 그래 이건 아니었어 용서할 수 없어 다시 나를 살린 이 노래를 불렀었지 기억하고 있니 어릴 적 예쁜 꿈들을 모두 다 이룰 수 있을 것 같던 시간들 소망을 꿈꾸며 주문을 외웠지 시간이 지나고 세상에 지쳐 갈 때쯤 꿈은 그저 꿈일 뿐인걸 알게 됐지만 어릴 적 주문을 아직 노래하네 언제나 힘들고 지칠때 날 일으켜주던 꿈이 가득한 이 노랠했어 나나나 나나나 나나나 나나나 나나나 나나나 나나나 나나나 어두워진 가리워진 나의 길을 밝혀주는 이 노래를 함께 해봐 어느 샌가 내게 찾아온 사랑을 위해 그렇게도 나를 애태운 그대를 위해 영원을 꿈꾸며 주문을 외웠지 피해갈수 없는 현실에 지쳐갈때쯤 무거워져 가는 걸음에 힘겨울때면 어릴적 주문을 노래 하곤 했지 언제나 힘들고 지칠때 날 일으켜주던 꿈이 가득한 이 노랠했어 나나나 나나나 나나나 나나나 나나나 나나나 나나나 나나나 어두워진 가리워진 나의 길을 밝혀주는 이 노래를 함께 해봐 자꾸만 어긋나 버리고 퇴색해 버리는 내 꿈을 지키고 싶었어 이기고 싶었어 누구도 가식의 가면을 버리지 않으려 끝끝내 발버둥 칠 때에 또 감추려 할때에 하늘에 새긴 내 어린 꿈들이 내 귓가에 들려준 이 노래 내 순수의 노래 키작은 아이의 함성과 내 사랑이 내게 들려준 이 노래 지켜갈 이 노래 언제나 힘들고 지칠때 날 일으켜주던 꿈이 가득한 이 노랠했어 나나나 나나나 나나나 나나나 나나나 나나나 나나나 나나나 초라하게 변해버린 나의 꿈을 밝혀주는 이 노래를 함께해봐 나나나 나나나 나나나 나나나 나나나 나나나 나나나 나나나 나나나 나나나 나나나 나나나 나나나 나나나 나나나 나나나,"2,591",1998,Steve Yoo,Na Na Na,C# Minor,12A,105.0,3:53,36.0,89.0,76.0,84.0,11.0,0.0,69.0,7.0,-4 dB,1998
9,이소라 믿음,믿음,이소라,발라드,힘든가요 내가 짐이 됐나요 음 마음을 보여줘요 안된대도 아무 상관없어요 내마음만 알아줘요 다른 사람 친한 그댈 미워하는 나의 사랑이 모자랐나요 늘 생각해요 이것만 기억해요 우리가 헤어지면 다시는 이런 사랑 또 없을테니 내게 힘이 돼줘요 난기다려요 그대 난 영원해요  우는 내가 많이 지겨웠나요 음~ 그래요 이해해요 많은 밤이 지나 그대 후회되면 다시 내게로 돌아올테니 다 괜찮아요 이것만 기억해요 우리가 헤어지면 다시는 이런사랑 또 없을테니 내게 힘이 돼줘요 난 기다려요 그댈 난 원해 그댈 사랑해 그대 난 영원해요 이것만 기억해요 우리가 헤어지면 다시는 이런사랑 또 없을테니 내게 힘이 돼줘요 난 기다려요 그댈 난 원해 그댈 사랑해 그대 난 영원해요,"35,614",1998,Lee So Ra,믿음,B Major,1B,97.0,4:48,17.0,21.0,20.0,7.0,93.0,0.0,11.0,3.0,-12 dB,1998
10,김민종 착한 사랑,착한 사랑,김민종,발라드,믿어지지 아니 믿을 수 없는 지금 이 순간을 기억해야 하나 사랑하고 있는 그대가 내 곁에서 떠나는 모습을 미안해서 내게 아무 말 없이 나를 버린거라 생각하고 나니 이해할 수 있어 그대를 사랑하니까 내 사랑이니까 울고있는 나는 내게 말했지 편안하게 지내야 한다고 나를 떠난 그대가 행복 할 수 있도록 어려워도 그래야 한다고 그대여 난 오늘도 너무 괴로워 하는 나를 달래보고 있지만 더 이상 견딜 수 없는 아픔에 살아 가는게 너무 힘들지만 하지만 사랑해요 난 그댈 울고있는 나는 내게 말했지 편안하게 지내야 한다고 나를 떠난 그대가 행복 할 수 있도록 어려워도 그래야 한다고 그대여 난 오늘도 너무 괴로워 하는 나를 달래보고 있지만 더 이상 견딜 수 없는 아픔에 살아 가는게 너무 힘들지만 하지만 사랑해요 난 그대여 난 오늘도 너무 괴로워 하는 나를 달래보고 있지만 더 이상 견딜 수 없는 아픔에 살아 가는게 너무 힘들지만 하지만 사랑해요 난 그댈,"2,349",1998,김민종,착한 사랑,D Major,10B,121.0,5:06,28.0,48.0,53.0,18.0,6.0,0.0,38.0,3.0,-7 dB,1998
11,조성모 To Heaven (천국으로 보낸 편지),To Heaven (천국으로 보낸 편지),조성모,발라드,괜찮은거니 어떻게 지내는거야 나 없다고 또 울고 그러진 않니 매일 꿈속에 찾아와 재잘대던 너 요즘은 왜 보이질 않는거니 혹시 무슨 일이라도 생겼니 내게 올 수 없을 만큼 더 멀리갔니 니가 없이도 나 잘 지내 보여 괜히 너 심술나서 장난 친거지 비라도 내리면 구름 뒤에 숨어서 니가 울고 있는 건 아닌지 걱정만 하는 내게 제발 이러지마 볼 수 없다고 쉽게 널 잊을 수 있는 내가 아닌걸 잘 알잖아 혹시 니가 없어 힘이 들까봐 니가 아닌 다른 사랑 만날 수 있게 너의 자릴 비워둔 것이라면 그 자린 절망 밖에 채울 수 없어 미안해 하지마 멀리 떠나갔어도 예전처럼 니 모습 그대로 내 안에 가득한데 그리 오래 걸리진 않을거야 이별이 없는 그곳에 우리 다시 만날 그날이 그때까지 조금만 날 기다려 줘,"8,040",1998,NOWZ,TICKET,C# Minor,12A,105.0,3:30,30.0,85.0,74.0,90.0,9.0,0.0,11.0,4.0,-3 dB,1998
12,김장훈 나와 같다면,나와 같다면 (김장훈),김연우,발라드,어떤 약속도 없는 그런 날에 너만 혼자 집에 있을때 넌 옛 생각이 나는지 그럴땐 어떡하는지 또 우울한 어떤날 음 비 마저 내리고 늘 우리가 듣던 노래가 라디오에서 나오면 나처럼 울고 싶은지 왜 자꾸만 후회되는지 나의 잘못했던 일과 너의 따뜻한 마음만 더 생각나 또 우울한 어떤날 음 비 마저 내리고 늘 우리가 듣던 노래가 라디오에서 나오면 나처럼 울고 싶은지 왜 자꾸만 후회되는지 나의 잘못했던 일과 너의 따뜻한 마음만 더 생각나 그대여 나와 같다면 내 마음과 똑같다면 그냥 나에게 오면 돼 널 위해 비워둔 내 맘 그 자리로,"28,910",1998,Kim Yeon Woo,나와 같다면 (김장훈),F Minor,4A,76.0,3:38,39.0,46.0,32.0,27.0,77.0,0.0,61.0,4.0,-6 dB,1998
13,김종환 사랑을 위하여,슬퍼하지 마,김종환,성인가요/트로트,아무말도 하지 않는거야~~~ 나에게 말을 해줘~~ 너에게 무슨일이 생긴건지~~ 속 시원히 말을 해줘~~ 이세상 모두가 변한다고 해도~~ 나는 너를 사랑해~~ 너에게 나를 준걸 후회는 안해~~ 이 대로 함께 있을께~~ 2 사랑할수 있을때 사랑 해야해~~ 서로 후회하지 않도록~~ 너의 곁에는 내가 있잖아~~ 너를 지킬 테니까~~ 용서할수 있을때 용서 해야해~~ 가슴이 아프지 않도록~~ 차라리 그것이 속편한 거야~~ 이젠~~슬퍼하지마~~   2 이세상에 여자는 너 하나뿐인데~~ 슬퍼하면 나는 어떻해~~ 니가~~힘이들면 내게로와~~ 내가 널 책임 지겠어~~,458,1998,김종환,사랑을 위하여,C Major,8B,148.0,4:21,26.0,45.0,44.0,24.0,44.0,0.0,10.0,3.0,-7 dB,1998
14,김경호 나의 사랑 천상(天上)에서도,나의 사랑 천상(天上)에서도,김경호,록/메탈,그런 일들은 없을 테지만 만약에 우리들이 떨어져 이 세상을 살아야 할 때 그땐 누군가가 너를 비웃어도 또 어떤 힘든 일이 생겨도 운다거나 마음 상해서 죽고 싶어질 때 나를 생각해 내 뜻으로 할 수 없는 건 사는 것 때론 죽는다는 것 그 어디에 있든지 우리 약속해 저 하늘이 나를 사랑해 어느 날 먼저 데려간대도 아름다운 세상 고운 너의 두 눈으로 내 몫까지 보아줘 저 하늘이 너를 사랑해 어느 날 너를 데려간다면 가슴속에 너의 사랑을 품고서 우리 사랑 키울게 천상으로 내가 곁에 없다고 너무 슬퍼하지마 우린 살아 있잖아 어느 곳에 있든지 우린 함께 숨을 쉬어 저 하늘이 나를 사랑해 어느 날 먼저 데려간대도 아름다운 세상 고운 너의 두 눈으로 내 몫까지 보아줘 저 하늘이 너를 사랑해 어느 날 너를 데려간다면 가슴 속에 너의 사랑을 품고서 우리 사랑 키울게 저 하늘이 나를 사랑해 어느 날 먼저 데려간대도 아름다운 세상 고운 너의 두 눈으로 내 몫까지 보아줘,"11,921",1998,김현성,Heaven,A♭ Major,4B,126.0,4:39,46.0,50.0,42.0,12.0,32.0,0.0,13.0,3.0,-7 dB,1998
15,박정현 P.S. I Love You,P.S. I Love You,박정현,발라드,우연히 그댈 처음 본 순간 운명이란걸 느낄 수가 있었어 사랑의 시작을 먼저 말할 수 없어 기다려온 시간들 외로움 처음 알게 되었어 난 두려워 우리 사랑한 뒤에 멀어진다면 다시 볼 수 없는걸 견딜 수 없기에 우정이라 말하고 그대곁에 있지만 너무나 깊은 사랑인걸 어떻게 하나 나 그대와의 만남과 다가올 슬픈 이별까지도 이제는 받아들일 수 있어 잠시 그대 나를 잊고 사는 그 순간에도 그대를 난 기억하며 살아갈테니 사랑해요 그대만을 영원히 그저 미소만으로 나를 사로잡았던 그대와 함께라는 것이 믿을수 없어 난 언제까지 그대를 원하며 살아간다는 것을 이제는 기억해주길 바래 내겐 하나뿐인 그댈 위해 내 모든것을 원해도 다 줄 수 있는 사람이라고 약속할께 처음느낌 그대로 이별까지도 남겨질수 있어 우-사랑해요 영원히-,"28,467",1998,Lena Park,P.S. I Love You,B Major,1B,132.0,3:57,30.0,44.0,58.0,14.0,58.0,0.0,33.0,4.0,-8 dB,1998
16,김정민 비(悲),비(悲),김정민,발라드,내가 없는 너의 하루는 내가 없는 너의 방안은 내가 없는 너의 미소는 여전히 눈부실까 이기적인 나를 용서해 그대 먼저 세상 떴다면 그건 살아있는 죽음이 내겐 됐을테니까 널 만나 모든게 다시 시작됐어 살아있다는게 너무도 행복했어 그래서 더욱 남김없이 후회없이 쓰고 떠나려 해 그날까지 남은 내 몫의 모든 사랑 슬픔으로 슬픔 잊히듯 다른 사랑으로 날 잊어 내가 눈을 감는 날부터 나는 너를 모를테니 널 만나 모든게 다시 시작됐어 살아있다는게 너무도 행복했어 그래서 더욱 남김없이 후회없이 쓰고 떠나려 해 그날까지 남은 내 몫의 모든 사랑 슬픔으로 슬픔 잊히듯 다른 사랑으로 날 잊어 내가 눈을 감는 날부터 나는 너를 모를테니,"2,402",1998,Kim Jung Min,비,C Minor,5A,87.0,4:01,30.0,38.0,51.0,16.0,19.0,0.0,9.0,3.0,-11 dB,1998
17,김종서 Epilogue(에필로그),Epilogue(에필로그),김종서,록/메탈,우연히 너를 보았지 그토록 기도했지만 다시는 만나지 않게 해 달라고 한때는 내 안의 너를 또 다른 나라 믿었어 지금은 운명이 달라 서로 다른 두 길을 가지만 네가 행복하길 바랄께 아주 먼 곳에서 보이지 않게 내게 전부였던 널 혼자 지키고 살면 돼 내가 싫어져 떠났다면 좋은 기억마저 가져가 버려 미움만이 남아서 제발 널 지울 수 있게 해 한때는 내 안의 너를 또 다른 나라 믿었어 지금은 운명이 달라 서로 다른 두 길을 가지만 네가 행복하길 바랄께 아주 먼 곳에서 보이지 않게 내게 전부였던 널 혼자 지키고 살면 돼 내가 싫어져 떠났다면 좋은 기억마저 가져가 버려 미움만이 남아서 제발 널 지울 수 있게 해 혼자남은 날 위해,"2,070",1998,Kim Jong Seo,Epilogue(에필로그),B Minor,10A,140.0,4:38,8.0,47.0,41.0,10.0,17.0,0.0,18.0,3.0,-7 dB,1998
