,artist_song,song_x,artist_x,genre,lyric,like,year_x,artist_y,song_y,key,camelot,bpm,duration,popularity,energy,danceability,happiness,acousticness,instrumentalness,liveness,speechiness,loudness,year_y
67,리아 개성,개성,리아,록/메탈,기계처럼 같은 생활 그것처럼 같은 생각 의미 없이 따라갔어 그래 그랬었었었어 공장에서 만들어낸 인형하고 똑같다지 누가 조금 다르다면 외면하고 무시하지  유행이란 이름으로 남들 눈을 의식하지 눈치보며 살게됐어 그래 그랬었었었어 같은 생각하며 살기엔 내 인생이 너무 아깝다고 생각했어 조금 튀게 난 살아갈거야 그 누가 뭐라 한다고 해도 yeah  어떻게 보면 내가 문제아로 생각되겠지만 그렇대도 나만의 생각이 필요한거야 나를 이해할 수가 없다고 해도 그런것쯤 신경 안 쓸거야 변하고 있는 지금 세상에는 나같은 사람도 필요해 눈치보는 시간사이 내모습은 이미 없어 그건 정말 아니었어 그래 그랬었었었어 나도 그런 생각이라면 내 인생이 너무 가치없다 생각했어 조금 달리 난 살아갈거야 쉽지는 않은 일이겠지만  어떻게 보면 내가 문제아로 생각되겠지만 그렇대도 나만의 생각이 필요한거야 나를 이해할 수가 없다고 해도 그런것쯤 신경 안 쓸거야 변하고 있는 지금 세상에는 나같은 사람도 필요해 소중한 건 나 자신야 남이 중요한 게 아냐 탓한다고 다가 아냐 잘못된건 생각인걸  어떻게 보면 내가 문제아로 생각되겠지만 그렇대도 나만의 생각이 필요해 아직도 어떻게 보면 내가 문제아로 생각되겠지만 그렇대도 나만의 생각이 필요한거야 나를 이해할 수가 없다고 해도 그런것쯤 신경 안 쓸거야 변하고 있는 지금 세상에는 나같은 사람도 필요해,704,1997,RIAA,개성,C Major,8B,120.0,4:11,2.0,81.0,76.0,77.0,0.0,0.0,23.0,4.0,-6 dB,1997
68,조규찬 믿어지지 않는 얘기,믿어지지 않는 얘기,조규찬,발라드,믿어지지 않는 얘길 들었지 내 가슴은 타버렸어 서로를 이해하기 위해 가졌던 그 시간동안 넌 변했지 내 옆에 있을 때보다 떨어져 있던 그 시간이 오히려 편한 느낌이었다고 너무도 차분한 그 눈빛 아래흐르는 그 입술 그 안에서 조용히 스며나오는 차가운 목소리 헤어지자고 아냐 이건 꿈이야 믿어지지 않는 얘길 들었지 내 가슴은 타버렸어 서로를 이해하기 위해 가졌던 그 시간동안 넌 변했지 내 옆에 있을 때보다 떨어져 있던 그 시간이 오히려 편한 느낌이었다고 너무도 차분한 그 눈빛 아래흐르는 그 입술 그 안에서 조용히 스며나오는 차가운 목소리 헤어지자고 아냐 이건 꿈이야 어떻게 이런 일이 내게 다가올 수 있는지 믿을 수 없어  내 옆에 있을 때보다 떨어져 있던 그 시간이 오히려 편한 느낌이었다고 너무도 차분한 그 눈빛 아래흐르는 그 입술 그 안에서 조용히 스며나오는 차가운 목소리 헤어지자고 아냐 이건 꿈이야,"3,691",1997,Cho Kyu Chan,I Can't Believe What You Say,G Major,9B,134.0,4:51,12.0,45.0,66.0,15.0,57.0,0.0,11.0,3.0,-9 dB,1997
69,김종서 영원,영원,김종서,록/메탈,그대만큼 사랑하는 세상이 있어  나 이제 나의 길 떠나가려해  언젠가 돌아보면 후회없기를  살아본 뒤에야 알게되겠지  (rep) 길에서 만난 세상의 모든것  그대와의 추억들  그 길에 서서 잠시 난 눈감아  슬픔이 다 잠들수있게~~~~  돌아간거야 나 있을곳으로  내가 닿을곳은 그대인걸 이젠알았어  사랑을 더 배우기 위한 길이 있잖아  우리 영원한 사랑 위해... 사랑해~~,"2,069",1997,Kim Jong Seo,영원,C Major,8B,140.0,4:18,8.0,56.0,38.0,12.0,19.0,0.0,9.0,3.0,-6 dB,1997
70,이승환 침묵의 기록,침묵의 기록,이승환,발라드,왜 나를 떠나 보내냐고 맘에도 없는 물음에 내 오랜 힘겨운 사랑은 비로소 끝이 났죠 내게서 슬픔을 찾으려 애쓰던 그 잔인한 사람들 무엇이 알고 싶었나요 무엇을 위해선가요 날 그만 내버려 둬요 충분히 아파했으니 외로워 해야만 나인 것 같아요 내가 짊어져야 하는 난 또 다른 사랑이 있기는 할까요 그건 사랑일까요 왜 그댄 떠나간 뒤에도 나를 힘들게 하고 있나요 여전히 그댄 예쁘군요 나 정말 아니죠  외로워 해야만 나인것 같아요 내가 짊어져야 하는 난 또 다른 사랑이 있기는 할까요 그건 사랑일까요  헤어진 후에야 그녀는 내게서 편히 쉴 수 있을거에요  날 인내해 왔던 그 시간들을 침묵 속으로 묻은 채,"22,893",1997,LEE SEUNG HWAN,침묵의 기록,B Major,1B,140.0,4:30,1.0,60.0,66.0,29.0,37.0,0.0,12.0,4.0,-7 dB,1997
71,유피 바다,바다,유피,댄스,나의 볼에 입맞춰 나를 사랑한다 말하는 널보면 마음이 더 불안해 가지더라도 절대 너만은 내꺼란걸 그렇게 말하고 다닐거야 왜 넌 내게만 자꾸자꾸 커져만 가는거야 왜 넌 내게만 자꾸자꾸 멀게만 느낀걸까 왜 넌 내게만 자꾸자꾸 커져만 가는거야 왜 넌 내게만 자꾸자꾸 멀게만 느낀걸까 울고 싶었어 내 앞에 널 봤을 때 너무도 커져버린 너였기에 나는 초라해 졌던거야 내 손을 잡아주길 바래 난 나를 보낼게 네게 나의 바다야 나의 하늘아 나를 안고서 그렇게 잠들면 돼 나의 바다야 나의 하늘아 난 너를 사랑해 언제나 나의 곁에 있는 널 왜 넌 내게만 자꾸자꾸 커져만 가는거야 왜 넌 내게만 자꾸자꾸 멀게만 느낀걸까 왜 넌 내게만 자꾸자꾸 커져만 가는거야 왜 넌 내게만 자꾸자꾸 멀게만 느낀걸까 야야야야야 야야야야야 야야야야야 야야야야야 야야야야야 야야야야야 야야야야야 야야야야야 나의 볼에 입맞춰 나를 사랑한다 말하는 널 보면 마음이 더 불안해 가지더라도 절대 너만은 내꺼란걸 그렇게 말하고 다닐거야 난난난난난 울고 싶었어 내 앞에 널 봤을 때 너무도 커져버린 너였기에 나는 초라해 졌던거야 내 손을 잡아주길 바래 난 나를 보낼게 네게 나의 바다야 나의 하늘아 나를 안고서 그렇게 잠들면 돼 나의 바다야 나의 하늘아 난 너를 사랑해 언제나 나의 곁에 있는 널 나의 바다야 나의 하늘아 나를 안고서 그렇게 잠들면 돼 나의 바다야 나의 하늘아 난 너를 사랑해 언제나 나의 곁에 있는 널 나의 바다야 나의 하늘아 난 너를 사랑해 언제나 나의 곁에 있는 널,"1,118",1997,UP,바다,A♭ Major,4B,126.0,3:49,0.0,93.0,77.0,78.0,5.0,0.0,34.0,6.0,-4 dB,1997
72,리아 4가지 하고 싶은말,4가지 하고 싶은말,리아,발라드,여름방학동안에 영원히 볼수없는 니가 되었지 믿을수 없는 사실이었어 니가 떠났던건 눈물은 소용없다 사람들 말했었지 그래 다시는 울지 않을께 내곁에 있다 생각을 할꺼야 지난 수많았던 기억속에 너를 떠올릴께 기억처럼 니가 오면 하고 싶은 말이 있어 슬픔도 기쁨도 지나치지 말라던 너의 말 영원히 기억할꺼야 언젠가 우리가 다시 만날때 같은 모습으로 나를 반겨줘 이제는 편안히 숨쉴수 있는 곳으로 어 너 가도돼 내가 지켜줄 테니 걱정마 난 남아 있을거야 영원히 니가 바란 그모습 그대로 너 가기 전엔 할수 없었던 네게 정말 말해주고 싶던 것들을 이젠 얘기 할게 슬픔도 기쁨도 지나치지 말라던 너의말 영원히 기억할꺼야 언젠가 우리가 다시 만날때 같은 모습으로 나를 반겨줘 이제는 편안히 숨쉴수 있는 곳으로 어 너 가도돼 내가 지켜줄 테니 걱정마 난 남아 있을거야 영원히 니가 바란 그모습 그대로,704,1997,VAV,ABC (Middle of the Night),B Minor,10A,104.0,3:26,21.0,91.0,70.0,67.0,27.0,0.0,23.0,13.0,-4 dB,1997
73,김정민 무한지애(無恨之愛),무한지애(無恨之愛),김정민,발라드,니가 없는 이 세상은 나에게는 어둠일 뿐이야. 나도 이제는 너를 따라서 이 세상을 떠나려해. 나는 다시 태어나도 내 사랑은 너 하나 뿐이야. 다음 세상에 만나는 그 날을 꿈꾸며 이젠 안녕~ 너는 웃으며 나를 반기겠지 그 눈빛을 난기억해. 어둠의 벽을넘어서 우리함께 다시 만나길 기도해 영원히 너만을 사랑해~한순간도 잊을수 없는너 기다려온 우리의사랑을 이제야 다시 만나게 됐어  처음 흰 눈이 어깨에 쌓일때 너를 위해 기도했어 성당의 종소리만이 희미하게 너의눈물을 위로해 영원히 너만을 사랑해 한순간도 잊을수 없는 너 기다려온 우리의사랑을 이제야다시 만나게 됐어 영원히 너만을 사랑해 한순간도 잊을수 없는너 기다려온우리의사랑을 이제야 다시 만나게 됐어 이젠 웃을수 있어,"2,402",1997,Kim Jung Min,무한지애,C Major,8B,72.0,4:33,33.0,53.0,41.0,23.0,60.0,0.0,13.0,3.0,-8 dB,1997
74,신효범 널 닮은 세상에서,널 닮은 세상에서,신효범,발라드,조금만 더 기다려줘 아직 늦지 않았다면 멍들어 시린 내 삶의 아픔 다 얘기하고 싶어 너의 한 숨 뒤로한 채 시간에 쫓긴 세월들 아무것도 묻지 말고 그냥 나의 손을 꼭 잡아줘 그래 난 항상 높은 곳을 향해 뭔가를 찾아 헤매곤 했지 세상이란 커다란 그림들 속에 숨겨진 보석을 그게 너 였음을 모른채  때로는 살아있음이 더 큰 비극일지라도 날 어루고 달래주는 사람 너밖에 없으니까  그래 난 항상 높은 곳을 향해 뭔가를 찾아 헤매곤 했지 세상이란 커다란 그림들 속에 숨겨진 보석을 그게 너였음을 모른채  조금만 더 기다려줘 지금 달려가고 있어 다시 아름다운 시선으로 살아가고픈 거야 널 닮은 이 땅의 끝에서,"1,135",1997,신효범,널 닮은 세상에서,A Major,11B,146.0,4:14,0.0,35.0,21.0,9.0,71.0,0.0,12.0,3.0,-8 dB,1997
75,젝스키스 연정 (戀情),연정 (戀情),젝스키스,댄스,와 버렸어 두려웠던 날이 와 버렸어 내게 머물던 그대 마음이 나 아닌 다른 사람에게 이제 완전하게 나를 떠나 버렸어 내가 줬던 반지 다시 돌려주며 그런 눈물 글썽 슬퍼하는 척해도 날 울리지마 이제 다신 속지 않아 너의 사랑스런 그 눈빛을 감아버려 뭐라고 말좀 해봐요 왓두와리 되돌릴 수는 없겠죠 왓두와리 이런 날 올 줄 알았어 왓두와리 그래도 가슴 무너지네요 날 사랑한 예쁜 입술로 이젠 잊으라고 말을 하시나요 아픈 가슴 참아도 눈물이 자꾸만 흘러요 다시는 나를 생각하지 말아요 내가 보고 싶어도 날 버린 그대 사랑하지 않을래 나 지금은 울고 있지만 관둬 누구도 나를 위로하진 못해 눈물 펑펑 운다 해도 죽지는 않아 그녀의 잘못 아니란 걸 잘 알잖아 사랑에 빠진 건 나의 잘못일 뿐 다만 나처럼 그녀 내가 없다 해도 아파하고 슬퍼하지 않게 해 잊지마 너의 기억 속으로 살아갈 내가 있어 사랑해 널 날 정말 사랑했나요 왓두와리 날 만나 행복했나요 왓두와리 잘해 주고 싶었어요 왓두와리 이제는 소용없는 얘기죠 날 사랑한 예쁜 입술로 이젠 잊으라고 말을 하시나요 아픈 가슴 참아도 눈물이 자꾸만 흘러요 다시는 나를 생각하지 말아요 내가 보고 싶어도 날 버린 그대 사랑하지 않을래 나 지금은 울고 있지만 기다릴게요 내가 필요하다면 언제라도 돌아와요 영원히 나를 잊어버린다 해도 그대 부디 행복하세요 Hey 우리가 함께 한 그 많은 시간 오오 Hey 우리의 추억 걱정하지 마요 눈물로 키워 갈 테니,"29,243",1997,SECHSKIES,Love,A Minor,8A,117.0,3:34,20.0,90.0,75.0,78.0,1.0,0.0,14.0,4.0,-5 dB,1997
76,임재범 그대는 어디에,그대는 어디에,임재범,발라드,지금도 기억속에 남겨진 그대 눈물 이제는 가슴속에 묻혀만 두긴 싫어 떠나야 했던 것도 모두가 우연일까 비오는 거릴보면 그대 다시 떠올라 아직도 함께 했던 그 많은 시간들을 그리며 나의 한숨 시간속에 남아 나를 눈물 짓게해 돌아올 그대 모습 그려보는 것만으로 너무나도 행복해진 나는 자꾸 눈물이 나는지 그대는 어디에  떠나야 했던 것도 모두가 우연일까 비오는 거릴보면 그대 다시 떠올라 아직도 함께 했던 그 많은 시간들을 그리며 나의 한숨 시간속에 남아 나를 눈물 짓게해 돌아올 그대 모습 그려보는 것만으로 너무나도 행복해진 나는 자꾸 눈물이 나는지 그대는 어디에,"14,544",1997,Sohyang,그대는 어디에 (원곡가수 임재범),C# Major,3B,132.0,4:37,25.0,45.0,40.0,19.0,48.0,0.0,85.0,3.0,-7 dB,1997
77,화이트 네모의 꿈,네모의 꿈,화이트,발라드,네모난 침대에서 일어나 눈을 떠보면 네모난 창문으로 보이는 똑같은 풍경 네모난 문을 열고 네모난 테이블에 앉아 네모난 조간신문 본뒤 네모난 책가방에 네모난 책들을 넣고 네모난 버스를 타고 네모난 건물지나 네모난 학교에 들어서면 또 네모난 교실 네모난 칠판과 책상들 네모난 오디오 네모난 컴퓨터 TV 네모난 달력에 그려진 똑같은 하루를 의식도 못한채로 그냥 숨만 쉬고 있는걸 주윌 둘러보면 모두 네모난 것들 뿐인데 우린 언제나 듣지 잘난 어른의 멋진 이 말 세상은 둥글게 살아야 해 지구본을 보면 우리 사는 지군 둥근데 부속품들은 왜 다 온통 네모난건지 몰라 어쩌면 그건 네모의 꿈일지 몰라 네모난 아버지의 지갑엔 네모난 지폐 네모난 팜플렛에 그려진 네모난 학원 네모난 마루에 걸려 있는 네모난 액자와 네모난 명함의 이름들 네모난 스피커 위에 놓인 네모난 테잎 네모난 책장에 꽂혀있는 네모난 사전 네모난 서랍속에 쌓여있는 네모난 편지 이젠 네모같은 추억들 네모난 태극기 하늘 높이 펄럭이고 네모난 잡지에 그려진 이달의 운수는 희망없는 나에게 그나마의 기쁨인가봐 주윌 둘러보면 모두 네모난 것들 뿐인데 우린 언제나 듣지 잘난 어른의 멋진 이 말 세상은 둥글게 살아야해 지구본을 보면 우리 사는 지군 둥근데 부속품들은 왜 다 온통 네모난 건지 몰라 어쩌면 그건 네모의 꿈일지 몰라,"2,304",1997,코케,네모의 꿈 : Originally Performed By 화이트 Karaoke Verison,D Major,10B,113.0,3:25,0.0,25.0,63.0,51.0,31.0,77.0,14.0,3.0,-17 dB,1997
78,R.ef 심연(深淵),심연(深淵),R.ef,댄스,너의 기억 깨져버려 너의 기억 지나가버려 나의 기억 기억에서 말이야 지워져 버리라는 말이야 내가 하고 싶은 말이야 하지만 그렇게 마음대로 안되는 이유는 뭐야 너야 바로 너야 Ah! 뭔데 니가뭔데 날 이리도 혼란스럽게 만들어 버리는데 내가 널 포기할순 없는건데 그런건데 너 나쁜-- 야 넌 정말 안되겠다 널 이해 못하겠다 난 너를 끝까지 잊을 수는 없을것 같다. 하지만 한번만 볼수있게만 된다면 그렇게만 된다면 난 너를 볼수는 있지만 너를 그대로 보내야만 된다는 그런 생각에 너를 놓아버릴 수 밖에 없-어 난 네맘을 바꿀 자신이 없어 나아안 이제야 나를 알겠어 BABY 사랑한 너의 모습 떠났고 말없이 두뺨에는 눈물이 너없이 살수 없다 느꼈어 이제 난 어떻해야 해 가슴이 아파 견딜수 없어 눈감고 너의 이름 불러봤지만 이렇게 가슴속이 메어와 울어도 넌 돌아오겠니  with all do repect we are back again bustin out with more rhyme than you expect without pain(pain) you can't gain(gain) and everything(thing) goes down the drain 내겐 너 하나밖에 없었는데 쉽게 널 놓치고 싶지 않았는데 내곁을 훌쩍 떠나버린 넌 내게 심적 부담을 줬어 그걸 알아 너는 몰라 너를 사랑한 내맘의 크기를 너는 몰라 만약 네가 알았다면 너는 나를 떠나지도 않았을 테니까 사랑한 너의 모습 떠났고 말없이 두뺨에는 눈물이 너없이 살수 없다 느꼈어 이제 난 어떻해야 해 가슴이 아파 견딜수 없어 눈감고 너의 이름 불러봤지만 이렇게 가슴속이 메어와 울어도 넌 돌아오겠니 너무 힘들어 너없이 살아가기란 너없이 아무것도 가진것도 없이 살아가기란 너의 맘은 편한지 날 두고 가버린 네가 그렇게 가고나면 모두 잊을수는 있는지 난 그렇체 못한체 미련을 버리지 못한채 이렇게 네게 벗어나지 못한채 너만을 생각을 하고 있을 뿐인데 그래 어서 나를 불러봐 내가 필요하다고 어서 불러봐 내겐 네가 필요한데 네겐 내가 불필요한지 왜그런지 그 이유를 내게 어서 말해봐 말할 필요조차 없는지 말하고 싶지 않은지 네 입이 떨어지질 않는지 대체 뭔지 내 마음을 너는 아는지 ah- ah- 떠나면 나는 어떻해야 해,"1,014",1997,R.ef,Abyss,C# Major,3B,204.0,4:33,10.0,89.0,61.0,58.0,15.0,0.0,32.0,36.0,-4 dB,1997
79,사준 Memories,Memories,사준,발라드,당신께 드릴 말이 있어요 지금껏 날 지켜준 당신에게 난 나의 마음을 숨긴채 웃어야 했죠 무너진 내 모습 그대 볼까봐 겉으로 자신있는 모습으로 난 지켜준 당신 앞에 웃고 있었죠 때론 실망한 적 많았죠 그대도 나처럼 약해질때 한없이 나의 아픔들은 모두 받아 줄거라 믿었는데 하지만 괜찮아요 이제 당신께 말할께요 한번도 그대 상처 감싸주지는 못했지만 난 괜찮아 떠나가도 돼 나를 눈물 감추며 날 지켜 봐준 그대를 보냈지만 언제나 널 지켜볼께 이제 넌 나의 곁에 다시 나에게 돌아와줘 언제까지라도 하지만 괜찮아요 이제 당신께 말할께요 한번도 그대 상처 감싸주지는 못했지만 난 괜찮아 떠나가도 돼 나를 눈물 감추며 날 지켜 봐준 그대를 보냈지만 언제나 널 지켜볼께 이제 넌 나의 곁에 다시 나에게 돌아와줘 너를 지켜줄께 떠나가도 돼 나를 눈물 감추며 날 지켜 봐준 그대를 보냈지만 언제나 널 지켜볼께 이제 넌 나의 곁에 다시 나에게 돌아와줘 언제까지라도 무너진 내 모습 그대 볼까봐 겉으로 자신있는 모습으로 난 지켜준 당신 앞에 웃고 있었죠,189,1997,Sa Joon,Memories,G Major,9B,136.0,4:19,16.0,46.0,38.0,27.0,53.0,0.0,11.0,4.0,-8 dB,1997
80,이지훈 왜 하늘은...,왜 하늘은...,이지훈,발라드,여기서 끝낼순 없어 이런건 날 위한게 아냐 얼마 남지 않은 시간 끝까지 함께 있을께 그렇게 포기하지마 나의 손을 잡아줘 부탁이야 너와 나 이 세상에서 마지막 여행을 떠나자 아무도 없는 곳으로 아픔은 가슴에 묻고 되도록 많은 세상을 보여주고 싶은데 함께 남은 시간이 모자라 왜 하늘은 널 데려 가는지 한 없이 착하기만 한 너를 아무것도 할수 없는 내 모습이 너무나 초라해 미칠것 같아 너 떠나는 날 흐르던 눈물 다시는 널 안을수 없기에 너를 따라 가고 싶어 니가 없는 세상에 혼자 남을 자신이 없어 왜 하늘은 널 데려가는지 한 없이 착하기만 한 너를 아무것도 할수 없는 내 모습이 너무나 초라해 미칠것 같아 너 떠나는 날 흐르던 눈물 다시는 널 안을수 없기에 너를 따라 가고 싶어 니가 없는 세상에 혼자 남을 자신이 없어,"1,066",1997,Lee Ji Hoon,Why Sky is,G Major,9B,76.0,4:35,24.0,69.0,40.0,14.0,40.0,0.0,9.0,4.0,-4 dB,1997
81,포지션 Summer Time,Summer Time,포지션,댄스,우리 함께한 이 여름 Summer Time 널 영원히 사랑해 I love you 나나나나나나나나나나나나 나나나나나나나나나  타오르는 저 태양아래 초록바다 저 하얀 구름이 까맣게 그을린 너의 모습 더욱 더 널 눈부시게 하네 부서지는 저 파도곁에 설탕같은 저 하얀 백사장 칵테일 한잔에 빨개진 네 얼굴 너무나도 아름다웠어 황홀한 저녁 노을에 널 닮은 바다향기에 너의 속삭임과 너의 달콤한 입맞춤에 취해 버렸어 우리 함께한 이 여름 Summer Time 널 영원히 사랑해 I love you 이대로 영원히 춤추며 노래해 모닥불이 꺼질 아침까지 여기 즐거운 바닷가 Summer Time 널 영원히 사랑해 Forever 끝없이 펼쳐진 여름 밤 하늘에 수많은 저 별들처럼 너를 사랑해  야자수와 코코넛 향기 한가로이 저 날아가는 새 내 품에 잠들은 너의 모습 더욱 더 날 행복하게 하네 아무것도 생각하지 마 내 품에서 꿈만 꾸면 돼 어제의 기억도 내일의 불안도 이제 너를 사랑하니까 해지는 Sunsetbar 에서 노을에 잠긴 너에게 이런 약속했지 너의 모든걸 사랑으로 지킬거라고 우리 함께한 이 여름 Summer Time 널 영원히 사랑해 I love you 이대로 영원히 춤추며 노래해 모닥불이 꺼질 아침까지 여기 즐거운 바닷가 Summer Time 널 영원히 사랑해 Forever 끝없이 펼쳐진 여름 밤 하늘에 수많은 저 별들처럼 너를 사랑해 나라나나 나나나나나나나나 나나나나나나 나나나나나나,"3,832",1997,Position,Summer time,C Minor,5A,132.0,4:07,17.0,99.0,61.0,63.0,12.0,0.0,35.0,9.0,-1 dB,1997
82,이지훈 이별,이별,이지훈,발라드,너를 보내고 돌아오는길 이제는 끝인걸 알아 나의 ？晝凋응？ 바라보던 널 잊을순 없겠지 눈물 흘리며 돌아오라는 너의 마지막 그말을 그저 외면하며 돌아섰던 난 더욱 더 슬펐어 하지만 사랑 했잖아 잡을수 없는 현실이 미울 뿐이야 괜찮아 아파해선 안돼 나의 모든걸 주었으니 사랑해 널 죽는 날까지 내마음 언제나 너 하나뿐인걸 너도 알고 있잖아 사랑해 이별 까지도 널 위해서 라면 더이상 사랑받지 못해도 지켜줄께  하지만 사랑 했잖아 잡을수 없는 현실이 미울 뿐이야 괜찮아 아파해선 안돼 나의 모든걸 주었으니 사랑해 널 죽는 날까지 내마음 언제나 너 하나뿐인걸 너도 알고 있잖아 사랑해 이별 까지도 널 위해서 라면 더이상 사랑받지 못해도 지켜줄께,"1,066",1997,Lee Ji Hoon,Farewell,B Minor,10A,144.0,3:55,3.0,47.0,48.0,15.0,52.0,0.0,12.0,3.0,-7 dB,1997
83,김원준 얄개시대,얄개시대,김원준,댄스,말세말세말세 훠 머리부터 발끝까지 말세말세말세 훠훠 이리보고 저리봐도 어른이라 믿었는데 말세말세말세 훠 누가뭐라 말을해도 말세말세말세 훠훠 어리다고 사랑하지 말란법은 없어 그래서 너를 너를 사랑해 어려도 좋아 예쁘고 깜찍한게 맘에 들어 이별은 싫어 너의 비밀 나만이 간직 할래 때론 애인 때론 동생처럼 사랑할테야 워 친구의 소개로 만나 첫눈에 반해버린 너 아무의심 하나없이 우린 연인이 되었지 넌 뭔가 숨기듯 나를 조심스레 만났고 그러던 어느날 우연히 보았어 교복입은 짧은 단발머리의 널 별이 반짝반짝반짝 어려도 좋아 예쁘고 깜찍한게 맘에 들어 이별은 싫어 너의 비밀 나만이 간직 할래 때론 애인 때론 동생처럼 사랑할테야 어쩌다 마주친 그대 눈빛이 내마음을 사로잡아 버렸네 말세말세말세 훠 머리부터 발끝까지 말세말세말세 훠훠 이리보고 저리봐도 어른이라 믿었는데 말세말세말세 훠 누가뭐라 말을해도 말세말세말세 훠훠 어리다고 사랑하지 말란법은없어 그래서 너를 너를 사랑해 넌 뭔가 숨기듯 나를 조심스레 만났고 그러던 어느날 우연히 보았어 교복입은 짧은 단발머리의 널 별이 반짝반짝반짝 어려도 좋아 예쁘고 깜찍한게 맘에 들어 이별은 싫어 너의 비밀 나만이 간직 할래 어려도 좋아 예쁘고 깜찍한게 맘에 들어 이별은 싫어 너의 비밀 나만이 간직 할래 때론 애인 때론 동생처럼 사랑할테야 때론 애인 때론 동생처럼 사랑할테야,"1,515",1997,Kim Won Jun,Yalgae Era,B Minor,10A,124.0,3:38,3.0,88.0,83.0,93.0,17.0,0.0,5.0,10.0,-4 dB,1997
